Razão social,CNPJ,Classificação
SIDERQUIMICA INDUSTRIA E COMERCIO DE PRODUTOS QUIMICOS S.,73.586.976/0001-61,Consumidor Especial
SIDERURGICA FENIX LTDA,05.826.942/0002-28,Consumidor Especial
SIDERURGICA SAO JOAQUIM SOCIEDADE ANONIM,45.365.541/0001-51,Consumidor Especial
SIDOR INDUSTRIA E COMERCIO LTD,61.064.846/0001-80,Consumidor Especial
SIDORE INDUSTRIA E COMERCIO DE REFRIGERANTES E AGUAS MINERAIS LTD,01.115.454/0001-70,Consumidor Especial
SIEMENS ENERGY BRASIL LTDA.,44.013.159/0001-16,Consumidor Especial
SIEMENS INFRAESTRUTURA E INDUSTRIA LTDA,34.776.007/0001-11,Consumidor Especial
SIEMENS HEALTHCARE DIAGNOSTICOS LTDA,01.449.930/0001-90,Consumidor Especial
SIER MOVEIS LTDA,38.705.406/0001-42,Consumidor Especial
SIERRA MOVEIS LTDA,92.726.785/0001-00,Consumidor Especial
SIG COMBIBLOC DO BRASIL LTDA,01.861.489/0001-59,Consumidor Especial
SIDERURGICA GAFANHOTO EIRELI,20.141.438/0001-05,Consumidor Especial
SIGELO EIRELI,01.685.419/0001-97,Consumidor Especial
INDUSTRIA MECANICA SIGRIST IMPORTACAO E EXPORTACAO LTD,50.080.092/0001-35,Consumidor Especial
SI GROUP CRIOS RESINAS S.A,44.246.528/0001-10,Consumidor Especial
SIGVARIS DO BRASIL INDUSTRIA E COMERCIO LIMITAD,46.144.622/0001-94,Consumidor Especial
SILGAN DISPENSING SYSTEMS BRAZIL INDUSTRIA DE EMBALAGENS LTDA,01.795.995/0004-30,Consumidor Especial
COPASUL COOPERATIVA AGRICOLA SUL MATOGROSSENS,03.902.129/0007-79,Consumidor Especial
COPASUL COOPERATIVA AGRICOLA SUL MATOGROSSENS,03.902.129/0018-21,Consumidor Especial
SILPA PECAS E EQUIPAMENTOS LTD,87.834.099/0001-05,Consumidor Especial
SIL - PLAST INDUSTRIA DE PLASTICOS LTD,08.000.956/0001-03,Consumidor Especial
SIM ESTEARINA INDUSTRIA E COMERCIO LTD,04.942.328/0001-88,Consumidor Especial
SIMBRAEX MARMORES E GRANITOS - EIREL,07.427.584/0001-25,Consumidor Especial
SIMETALL INDUSTRIA E COMERCIO DE FERRAMENTAS LTD,87.829.495/0001-44,Consumidor Especial
TEXTIL NORBERTO SIMIONATO LTD,44.207.389/0001-16,Consumidor Especial
SIMOLDES PLASTICOS BRASIL LTDA,01.640.335/0001-37,Consumidor Especial
METALURGICA SIMONAGGIO LTDA,87.859.278/0001-05,Consumidor Especial
"SIMONAGGIO &amp, CIA LTDA.",90.055.724/0001-25,Consumidor Especial
INDUSTRIA DE MOVEIS SIMOSUL LTD,85.494.201/0001-45,Consumidor Especial
CONSTRUTORA SIMOSO LTDA,48.169.536/0001-61,Consumidor Especial
REDE SIMPATIA COMERCIO DE ALIMENTOS LTD,07.722.158/0001-14,Consumidor Especial
SIN - SISTEMA DE IMPLANTE NACIONAL S.A,04.298.106/0001-74,Consumidor Especial
SINA INDUSTRIA DE ALIMENTOS LTD,10.156.658/0002-21,Consumidor Especial
SINAGRO PRODUTOS AGROPECUARIOS S.,04.294.897/0001-64,Consumidor Especial
SINALSUL INDUSTRIA DE AUTO PECAS LTD,90.097.791/0001-02,Consumidor Especial
SINCOL SA INDUSTRIA E COMERCIO,83.053.660/0001-68,Consumidor Especial
SINCOPLASTIC INDUSTRIA E COMERCIO DE PLASTICOS LTD,00.632.761/0001-66,Consumidor Especial
CONDOMINIO DE GALPOES SINDI INVESTIMENTO,08.627.728/0001-50,Consumidor Especial
SINGER DO BRASIL INDUSTRIA E COMERCIO LTD,61.432.506/0001-64,Consumidor Especial
SINTEQUIMICA DO BRASIL LIMITADA,10.576.411/0003-45,Consumidor Especial
SINTER FUTURA LTDA,74.222.563/0001-60,Consumidor Especial
SINTERAMA DO BRASIL LTDA,04.532.470/0001-57,Consumidor Especial
SINTEX - TINTURARIA INDUSTRIAL LTD,02.209.586/0001-24,Consumidor Especial
SINTO BRASIL PRODUTOS LIMITADA.,43.735.901/0001-34,Consumidor Especial
SIOL ALIMENTOS LTDA,44.242.287/0001-31,Consumidor Especial
SIRMAX DO BRASIL COMERCIO E INDUSTRIA DE PLASTICOS LTDA,17.133.267/0001-50,Consumidor Especial
SERGIPE INDUSTRIAL TEXTIL LTD,13.006.218/0002-86,Consumidor Especial
SISA SAUIPE INDUSTRIAL S/A,11.174.306/0001-80,Consumidor Especial
FORNECEDORA JACOME COMERCIO E INDUSTRIA LTD,18.979.708/0001-00,Consumidor Especial
SKF DO BRASIL LTDA,61.077.327/0001-56,Consumidor Especial
SK RECICLAGEM LTDA,15.788.206/0001-03,Consumidor Especial
"SORVETES SKIMIL &amp, SKIMONI LTD",43.257.591/0001-90,Consumidor Especial
SKS INDUSTRIA| COMERCIO E SERVICO PARA CONSTRUCAO LTD,31.273.842/0001-40,Consumidor Especial
SKYSTONE DO BRASIL LTDA,22.134.215/0001-38,Consumidor Especial
SL CEREAIS E ALIMENTOS LTDA,81.066.938/0001-06,Consumidor Especial
SEMENTES PARANA LTDA,04.415.166/0001-20,Consumidor Especial
SLC AGRICOLA S.A.,89.096.457/0001-55,Consumidor Especial
SUPERMERCADOS ALVORADA EIRELI,17.833.301/0001-07,Consumidor Especial
SMALTICERAM UNICER DO BRASIL LTDA,02.750.009/0001-45,Consumidor Especial
SMART MODULAR TECHNOLOGIES DO BRASIL - INDUSTRIA E COMERCIO DE COMPONENTES LTDA,11.576.445/0001-30,Consumidor Especial
SMART MODULAR TECHNOLOGIES INDUSTRIA DE COMPONENTES ELETRONICOS LTDA,06.103.827/0001-07,Consumidor Especial
SHOPPING METRO BOULEVARD TATUAPE,10.254.617/0001-97,Consumidor Especial
SMH SOCIEDADE MEDICO HOSPITALAR LTD,31.160.674/0001-87,Consumidor Especial
SMR AUTOMOTIVE BRASIL LTDA.,11.554.758/0001-98,Consumidor Especial
SMS STAMP INJET METALURGICA LTD,03.420.195/0001-17,Consumidor Especial
SMURFIT KAPPA DO BRASIL INDUSTRIA DE EMBALAGENS BENTO GONCALVES LTDA,94.551.850/0001-21,Consumidor Especial
SMURFIT KAPPA DO BRASIL INDUSTRIA DE EMBALAGENS FORTALEZA LTDA,02.500.041/0001-72,Consumidor Especial
SNACKS PRODUTOS ALIMENTICIOS LTD,05.863.041/0001-25,Consumidor Especial
SNELLOG - ARMAZENS GERAIS E LOGISTICA LTDA,09.092.389/0001-17,Consumidor Especial
CONDOMINIO OPERACIONAL DO SHOPPING SO MARCAS OUTLE,12.429.281/0001-81,Consumidor Especial
SONACA BRASIL LTDA,04.059.223/0001-85,Consumidor Especial
SOBRAL INVICTA SOCIEDADE ANONIMA,60.594.538/0002-84,Consumidor Especial
SOBRITA INDUSTRIAL S A,27.061.563/0001-46,Consumidor Especial
SOCIEDADE DE EDUCACAO NOSSA SENHORA DO PATROCINIO LTDA,45.466.752/0001-80,Consumidor Especial
SOCEL SOCIEDADE OESTE LTDA,08.249.708/0001-92,Consumidor Especial
SOCER RB INDUSTRIA E COMERCIO LTDA,01.593.699/0001-03,Consumidor Especial
SOCIEDADE DE EDUCACAO SUPERIOR E CULTURA BRASIL S.A,84.684.182/0001-57,Consumidor Especial
SOCIMED SERVICOS HOSPITALARES S.,01.595.799/0001-79,Consumidor Especial
ACQUA AGUA DE COCO DA AMAZONIA INDUSTRIA E COMERCIO LTDA,83.914.598/0001-51,Consumidor Especial
SOCOCO SA INDUSTRIAS ALIMENTICIAS,12.285.276/0001-42,Consumidor Especial
AMAFIBRA - FIBRAS E SUBSTRATOS AGRICOLAS DA AMAZONIA LTD,03.548.281/0001-00,Consumidor Especial
SOCOCO S/A - AGROINDUSTRIAS DA AMAZONI,05.832.555/0001-13,Consumidor Especial
SOCORRO INDUSTRIA DE BEBIDAS LTDA,12.314.267/0001-32,Consumidor Especial
SODEBO DO BRASIL INDUSTRIA E COMERCIO DE PRODUTOS ALIMENTICIOS LTDA,17.557.354/0001-34,Consumidor Especial
SODECIA MINAS GERAIS INDUSTRIA DE COMPONENTES AUTOMOTIVOS LTD,02.454.348/0001-84,Consumidor Especial
SODECIA DA AMAZONIA LTDA,02.422.460/0001-33,Consumidor Especial
SODECIA DA BAHIA LTDA,04.095.571/0002-99,Consumidor Especial
CONSTRUDECOR S/A,03.439.316/0001-72,Consumidor Especial
TENERIFE EMPREENDIMENTOS E PARTICIPACOES LTD,23.842.876/0001-80,Consumidor Especial
SOFT FILM INDUSTRIA E COMERCIO DE PLASTICOS LTD,10.829.587/0001-08,Consumidor Especial
SOGEFI FILTRATION DO BRASIL LTD,66.975.699/0001-13,Consumidor Especial
SOGEFI SUSPENSION BRASIL LTDA.,02.042.860/0001-13,Consumidor Especial
SO GELO INDUSTRIA E COMERCIO EIREL,43.736.610/0002-41,Consumidor Especial
SOCIEDADE DE GINASTICA PORTO ALEGRE 186,92.913.607/0001-80,Consumidor Especial
INDUSTRIA DE PRODUTOS DE MANDIOCA SOL LTD,46.061.669/0001-94,Consumidor Especial
SOL INDUSTRIA E COMERCIO DE BEBIDAS LTD,05.105.162/0001-08,Consumidor Especial
MARBRAN INDUSTRIA COMERCIO E TRANSPORTE EIREL,70.928.650/0001-87,Consumidor Especial
SOLENIS DO BRASIL QUIMICAS LTDA,03.945.556/0001-49,Consumidor Especial
SOLIDA BRASIL MADEIRAS LTDA,10.556.018/0002-09,Consumidor Especial
SOLLUS MECANIZACAO AGRICOLA LTDA,01.369.005/0001-59,Consumidor Especial
SOLO-FERTIL INDUSTRIA E COMERCIO LTD,21.652.599/0001-18,Consumidor Especial
SOLOFILER INDUSTRIA E COMERCIO DE CALCARIOS FINOS LTD,76.216.480/0001-94,Consumidor Especial
SOLOFINO INDUSTRIA E COMERCIO DE CAL E CALCARIO LTD,79.348.207/0001-01,Consumidor Especial
SOLPACK LTDA,02.639.570/0001-51,Consumidor Especial
FABRICA DE COMPENSADOS ULIANA EIREL,22.926.299/0001-42,Consumidor Especial
SOL PP INDUSTRIA DE PLASTICOS LTD,03.886.732/0001-19,Consumidor Especial
SOLUCOES EM ACO USIMINAS S.A.,42.956.441/0001-01,Consumidor Especial
SOLUTIONS 2 GO DO BRASIL INDUSTRIA| COMERCIO E DISTRIBUICAO LTD,07.305.913/0001-65,Consumidor Especial
SOLUZIONE MOVEIS LTDA,14.625.998/0001-24,Consumidor Especial
SOM DIAGNOSTICOS LTDA,14.055.768/0001-77,Consumidor Especial
SOMA NUTRICAO ANIMAL INDUSTRIA E COMERCIO EIREL,64.322.423/0001-00,Consumidor Especial
SOMA SOLUCOES MAGNETICAS INDUSTRIA E COMERCIO LTDA,54.472.873/0001-26,Consumidor Especial
SOMAI NORDESTE S/A,22.673.347/0001-38,Consumidor Especial
SOMAPAR SOCIEDADE MADEIREIRA PARANAENSE LTD,76.743.012/0001-78,Consumidor Especial
SOMAVE AGROINDUSTRIAL LTDA,06.353.241/0001-09,Consumidor Especial
SOMMAPLAST INDUSTRIA E COMERCIO LTD,00.519.577/0001-04,Consumidor Especial
SOMOS SISTEMAS DE ENSINO S.A.,49.323.314/0001-14,Consumidor Especial
SONDA SUPERMERCADOS EXPORTACAO E IMPORTACAO S.A,01.937.635/0001-82,Consumidor Especial
SONDA PROCWORK INFORMATICA LTD,08.733.698/0008-32,Consumidor Especial
SONETTO MOVEIS LTDA,05.889.519/0001-96,Consumidor Especial
SONO BRASIL INDUSTRIA| COMERCIO| IMPORTACAO E EXPORTACAO LTD,24.120.831/0001-65,Consumidor Especial
SONOCO DO BRASIL LTDA,00.496.586/0006-31,Consumidor Especial
SOORO RENNER NUTRICAO S/A,04.208.296/0001-91,Consumidor Especial
SOPASTA S/A INDUSTRIA E COMERCIO,86.352.069/0001-08,Consumidor Especial
SOPPRO MAXXI RIO INDUSTRIA E COMERCIO DE PLASTICOS LTD,06.226.380/0001-63,Consumidor Especial
SOPRANO INDUSTRIA ELETROMETALURGICA EIREL,88.634.977/0001-01,Consumidor Especial
SOPRASINOS INDUSTRIA E COMERCIO DE PLASTICOS LTD,00.563.273/0001-44,Consumidor Especial
SOROCABA REFRESCOS S.A.,45.913.696/0001-85,Consumidor Especial
SOROCAPS INDUSTRIA FARMACEUTICA LTD,09.542.984/0001-07,Consumidor Especial
SORVEBOM INDUSTRIAL LTDA,01.967.318/0001-09,Consumidor Especial
PRODUTOS ALIMENTICIOS MACORTEZA LTD,88.665.674/0001-56,Consumidor Especial
INDUSTRIA E COMERCIO DE ALIMENTOS GURI LTD,79.743.357/0001-10,Consumidor Especial
SORVETES LAMOIA LTDA,26.262.847/0001-38,Consumidor Especial
SORVETES SUPLES INDUSTRIA E COMERCIO LTD,43.204.189/0001-47,Consumidor Especial
INDUSTRIA DE SORVETES E DERIVADOS LTD,01.238.035/0001-26,Consumidor Especial
SOS CARDIO SERVICOS HOSPITALARES LTD,85.307.098/0001-87,Consumidor Especial
SOTHERM TRATAMENTO TERMICO LTD,01.155.574/0001-00,Consumidor Especial
SOTRIGO SOCIEDADE TRITICOLA DE GOIAS EIREL,04.577.125/0001-30,Consumidor Especial
SOUBACH BENEFICIAMENTO EM COUROS LTD,93.062.941/0001-30,Consumidor Especial
SOUFER INDUSTRIAL LTDA.,45.987.062/0001-77,Consumidor Especial
SOUTH PINE MADEIRAS EIRELI,08.248.443/0001-08,Consumidor Especial
"SOUZA &amp, CAMBOS CONFECCOES LTD",67.331.991/0001-66,Consumidor Especial
SOUZA CRUZ LTDA,33.009.911/0001-39,Consumidor Especial
SOUZA CRUZ LTDA,33.009.911/0083-85,Consumidor Especial
SOUZA CRUZ LTDA,33.009.911/0306-31,Consumidor Especial
CONDOMINIO SP MARKET CENTER,01.086.381/0001-36,Consumidor Especial
SP QUEIROZ COMERCIO E INDUSTRIA LTD,71.408.793/0001-20,Consumidor Especial
HARVEST ADMINISTRACAO DE BENS LTD,04.312.910/0002-41,Consumidor Especial
SPAL INDUSTRIA BRASILEIRA DE BEBIDAS S/,61.186.888/0001-93,Consumidor Especial
SPAZIO OURO VERDE EMPREENDIMENTOS E PARTICIPACOES S.A,08.736.012/0001-90,Consumidor Especial
MANFRIM INDUSTRIAL E COMERCIAL LTD,56.813.280/0002-92,Consumidor Especial
INDUSTRIA| COMERCIO| IMPORTACAO E EXPORTACAO DE VIDROS TEMPERADOS SPEED TEMPER LTDA,73.122.996/0001-81,Consumidor Especial
SPF DO BRASIL INDUSTRIA E COMERCIO LTD,00.981.411/0001-05,Consumidor Especial
SAO PAULO FUTEBOL CLUBE,60.517.984/0001-04,Consumidor Especial
SPGPRINTS BRASIL LTDA,61.939.419/0001-06,Consumidor Especial
SIMOLDES PLASTICOS INDUSTRIA LIMITAD,01.214.052/0002-04,Consumidor Especial
SPILTAG INDUSTRIAL LTDA,00.573.283/0001-60,Consumidor Especial
SPLACK S.A.,01.548.458/0001-42,Consumidor Especial
"SAMPAIO &amp, MORAES LTDA",10.385.998/0001-43,Consumidor Especial
SPLENDORE INDUSTRIA E COMERCIO DE MOVEIS EIREL,07.550.911/0001-31,Consumidor Especial
INBEB - INDUSTRIAL NORTE PARANAENSE DE BEBIDAS LTD,03.485.089/0001-11,Consumidor Especial
SPORT CLUB CORINTHIANS PAULISTA,61.902.722/0001-26,Consumidor Especial
BRASCADM GESTAO LTDA,09.067.645/0001-16,Consumidor Especial
LATINA AGRO INDUSTRIA E COMERCIO DE FERTILIZANTES LTD,06.287.157/0001-26,Consumidor Especial
RODOVIAS INTEGRADAS DO OESTE S/,03.497.792/0001-40,Consumidor Especial
JOINVILLE SQUARE GARDEN EVENTOS LTDA,12.594.548/0001-96,Consumidor Especial
S.R. EMBALAGENS PLASTICAS LTD,50.418.557/0001-15,Consumidor Especial
SR PAO PANIFICACAO E ALIMENTOS CONGELADOS LTD,05.454.168/0001-90,Consumidor Especial
SR EMBALAGENS PLASTICAS TRES RIOS LTD,11.363.676/0001-66,Consumidor Especial
SR PLAST INDUSTRIA E COMERCIO DE EMBALAGENS PLASTICAS LTD,07.883.134/0001-47,Consumidor Especial
CONDOMINIO SALVADOR TRADE CENTE,05.246.359/0001-67,Consumidor Especial
SSALTTEC INJETADOS TERMOPLASTICOS LTD,04.705.784/0001-04,Consumidor Especial
S.S.B. ENERGIA RENOVAVEL LTDA,53.905.543/0001-14,Consumidor Especial
STRETCH SHRINK FILM LTDA,01.049.356/0001-82,Consumidor Especial
IRMANDADE DA SANTA CASA DE MISERICORDIA DE PORTO ALEGR,92.815.000/0001-68,Consumidor Especial
ST FLEX EMBALAGENS FLEXIVEIS EIREL,62.877.956/0001-23,Consumidor Especial
ST JUDE MEDICAL BRASIL LTDA,00.986.846/0009-08,Consumidor Especial
ASSOCIACAO BENEFICENTE SANTA MARI,30.717.813/0001-68,Consumidor Especial
STAACK TINTURARIA LTDA,03.061.133/0001-66,Consumidor Especial
CONDOMINIO STADIUM,05.436.246/0001-24,Consumidor Especial
STAHL BRASIL SA,89.488.316/0006-92,Consumidor Especial
STAM METALURGICA LTDA,30.560.205/0001-92,Consumidor Especial
STAMPLINE METAIS ESTAMPADOS LTD,73.070.294/0001-00,Consumidor Especial
STAMPTEC INDUSTRIA E COMERCIO DE PECAS ESTAMPADAS LTD,96.477.666/0001-04,Consumidor Especial
STAR SU INDUSTRIA DE FERRAMENTAS LTDA,43.876.952/0001-86,Consumidor Especial
STAR TEMPER VIDROS - EIRELI,04.666.832/0001-00,Consumidor Especial
STARCOLOR PROTECAO E DECORACAO DE ALUMINIO EIREL,83.032.359/0001-78,Consumidor Especial
STARPACK PLASTICOS INDUSTRIAIS EIREL,67.038.844/0001-00,Consumidor Especial
STAR PEX INDUSTRIA DE VIDROS E ABERTURAS LTD,14.801.362/0001-96,Consumidor Especial
STAR PLAST INDL E COML PARANAENSE DE PLASTICOS LTD,79.620.159/0001-69,Consumidor Especial
STARPLAST INDUSTRIA E COMERCIO LTD,54.649.470/0001-00,Consumidor Especial
STARRETT INDUSTRIA E COMERCIO LTD,56.994.700/0001-01,Consumidor Especial
STECK DA AMAZONIA INDUSTRIA ELETRICA LTD,06.048.486/0001-14,Consumidor Especial
STECK INDUSTRIA ELETRICA LTDA,05.890.658/0001-30,Consumidor Especial
STEEL ROL INDUSTRIA E COMERCIO DE EMBALAGENS METALICAS LTD,58.954.850/0001-09,Consumidor Especial
STEELMAST METALURGICA LTDA,07.229.006/0001-84,Consumidor Especial
STEELTRATER TRATAMENTOS TERMICOS LTD,08.993.358/0001-74,Consumidor Especial
LATICINIOS BIO LTDA.,05.939.266/0001-18,Consumidor Especial
STEKPLAST INDUSTRIA E COMERCIO DE PLASTICOS LTD,96.628.748/0001-02,Consumidor Especial
STI-SADALLA TECNOLOGIA INDUSTRIAL LTD,04.183.301/0001-59,Consumidor Especial
S.T.K. USINAGEM LTDA,03.387.558/0001-60,Consumidor Especial
STOCK TECH S.A. ARMAZENS GERAIS,01.306.014/0001-09,Consumidor Especial
STOLTHAVEN SANTOS LTDA,51.979.359/0001-93,Consumidor Especial
CONDOMINIO STOP SHOP,02.129.852/0001-09,Consumidor Especial
SAS COMERCIO DE SECOS E MOLHADOS LTD,12.279.637/0001-48,Consumidor Especial
G S COMERCIO DE PRODUTOS ALIMENTICIOS LTD,27.895.447/0001-22,Consumidor Especial
SINDICATO DOS TRABALHADORES RURAIS DE LAJEAD,91.165.829/0001-08,Consumidor Especial
ATHANASE SARANTOPOULOS HOTEIS E TURISMO LTD,48.011.688/0001-31,Consumidor Especial
AP BETIM COMERCIO DE PECAS AUTOMOTIVAS LTD,13.510.116/0001-12,Consumidor Especial
ESTUDIO AMAZONICO DE RADIODIFUSAO LTD,05.444.807/0001-37,Consumidor Especial
CALCENTER - CALCADOS CENTRO-OESTE LTD,15.048.754/0001-99,Consumidor Especial
STYLO - INDUSTRIA E COMERCIO DE VIDROS LTD,16.925.894/0001-60,Consumidor Especial
STYROPLAST - ESPUMAS INDUSTRIAIS LTDA,04.074.553/0001-40,Consumidor Especial
SUATA SERVICO UNIFICADO DE ARMAZENAGEM E TERMINAL ALFANDEGADO S,03.928.105/0001-01,Consumidor Especial
INDUSTRIAS SUAVETEX LTDA,02.313.832/0001-93,Consumidor Especial
SUCONOR S.A.,12.726.493/0001-20,Consumidor Especial
SUCORRICO CITRUS INDUSTRIAL E AGRICOLA LTDA,16.930.087/0001-36,Consumidor Especial
INDUSTRIA DE COMPENSADOS SUDATI LTD,02.314.153/0001-39,Consumidor Especial
INDUSTRIAS TEXTEIS SUECO LTDA,62.781.778/0001-32,Consumidor Especial
SUGAR SHOES INDUSTRIA DE CALCADOS LTDA,04.358.307/0007-05,Consumidor Especial
MADSON ELETROMETALURGICA LTDA,20.520.367/0001-43,Consumidor Especial
SUINCO - COOPERATIVA DE SUINOCULTORES LTD,06.067.949/0001-95,Consumidor Especial
SUL DEFENSIVOS AGRICOLAS LTDA,76.676.436/0001-67,Consumidor Especial
SUL-CORTE IMPORTADORA DE FERRAMENTAS LTD,00.205.734/0001-07,Consumidor Especial
SUL PET PLASTICOS LTDA,02.857.584/0001-41,Consumidor Especial
SUL PORTAS INDUSTRIA DE PORTAS LTD,83.572.826/0001-52,Consumidor Especial
SUL TERMOPLASTICOS INDUSTRIA E BENEFICIAMENTO LTD,22.902.692/0001-04,Consumidor Especial
SULAMERICANA CONFECCOES EIRELI,13.225.302/0001-00,Consumidor Especial
SULBRAS MOLDES E PLASTICOS LTD,89.729.867/0001-96,Consumidor Especial
SULCROMO REVESTIMENTOS INDUSTRIAIS LTD,87.827.457/0003-14,Consumidor Especial
SULCROMO REVESTIMENTOS INDUSTRIAIS LTD,87.827.457/0001-52,Consumidor Especial
SULGLASS - INDUSTRIA E COMERCIO DE VIDROS LTD,08.584.497/0001-44,Consumidor Especial
SULINA DE METAIS SA,92.660.893/0001-10,Consumidor Especial
SULMAQ INDUSTRIAL E COMERCIAL S,87.861.324/0001-00,Consumidor Especial
SULNOVE INDUSTRIA DE EMBALAGENS EIREL,06.889.781/0001-01,Consumidor Especial
SULPLAST FIBRA DE VIDRO E TERMOPLASTICO LTD,52.287.497/0001-74,Consumidor Especial
SULPRINT EMBALAGENS INDUSTRIAIS LTD,95.422.697/0001-03,Consumidor Especial
SULTECNICA INDUSTRIA DE PECAS PLASTICAS E MOLDES LTDA,87.392.825/0001-87,Consumidor Especial
SUMABRAS DO BRASIL - INDUSTRIA E COMERCIO DE SUCOS DE MACA LTDA,17.321.958/0001-87,Consumidor Especial
SUMITOMO INDUSTRIAS PESADAS DO BRASIL LTDA,12.525.361/0001-30,Consumidor Especial
SUMITOMO CHEMICAL BRASIL INDUSTRIA QUIMICA S.A,07.467.822/0001-26,Consumidor Especial
SUMMA POLIMEROS LTDA.,09.052.494/0001-22,Consumidor Especial
INDUSTRIA E COMERCIO ALIMENTICIA SUN PLANT LTD,00.831.245/0001-60,Consumidor Especial
SUOMINEN BRASIL INDUSTRIA E COMERCIO DE NAO-TECIDOS LTDA,14.405.122/0001-72,Consumidor Especial
A. C. D. A. IMPORTACAO E EXPORTACAO LTD,84.308.980/0001-84,Consumidor Especial
SUPERMERCADOS BH COMERCIO DE ALIMENTOS S/,04.641.376/0001-36,Consumidor Especial
COF SUPERMERCADOS LTDA,27.883.819/0001-09,Consumidor Especial
SB SUPERMERCADOS S/A,23.719.030/0001-58,Consumidor Especial
SUPERMERCADOS CAVICCHIOLLI LTD,43.259.548/0001-63,Consumidor Especial
SUPER MERCADO DO POVO LTDA,10.389.021/0001-02,Consumidor Especial
DINIZ SUPERMERCADOS LIMITADA,03.123.142/0001-34,Consumidor Especial
SUPER FINISHING DO BRASIL COMERCIAL LTDA,96.411.855/0001-84,Consumidor Especial
ANCORA DISTRIBUIDORA DE ALIMENTOS LTD,03.879.760/0001-09,Consumidor Especial
SUPER KAN LTDA,03.521.220/0001-59,Consumidor Especial
MWN COMERCIAL DE ALIMENTOS LTD,04.601.165/0001-70,Consumidor Especial
SUPER LIS SUPERMERCADO EIRELI,07.255.463/0001-43,Consumidor Especial
SUPERMERCADOS MANAIRA LTDA,09.143.892/0001-54,Consumidor Especial
SUPERMERCADOS MIALICH LTDA,52.004.785/0001-74,Consumidor Especial
OSMAR NICOLINI SUPERMERCADOS LTD,89.835.672/0001-20,Consumidor Especial
SUPERMERCADO NORDESTAO LTDA,08.030.363/0001-81,Consumidor Especial
RARO INDUSTRIA DE ALIMENTOS LTD,11.483.174/0001-79,Consumidor Especial
F J FEIJO DE ALBUQUERQUE,01.377.961/0001-82,Consumidor Especial
SUPER TERMINAIS COMERCIO E INDUSTRIA LTD,04.335.535/0002-55,Consumidor Especial
SUPER TOYS - INDUSTRIA E COMERCIO DE ARTEFATOS PLASTICOS LTD,05.104.958/0001-46,Consumidor Especial
SUPERBAC INDUSTRIA E COMERCIO DE  FERTILIZANTES S.,02.599.378/0001-89,Consumidor Especial
SUPERCAL EXTRACAO DE CALCARIO E BRITA LTD,16.896.097/0001-00,Consumidor Especial
SUPERCAL PAINS LTDA,71.138.572/0001-80,Consumidor Especial
SUPERFINE STEEL ACOS INOXIDAVEIS LTD,00.749.526/0001-79,Consumidor Especial
SUPERFIOS TEXTIL LTDA,01.912.239/0001-09,Consumidor Especial
SUPERFLEX PRODUTOS DE BORRACHA LTD,05.034.914/0001-97,Consumidor Especial
SUPERFRIO ARMAZENS GERAIS S.A,02.060.862/0011-07,Consumidor Especial
SUPERFRUT SORVETES LTDA,09.243.752/0001-58,Consumidor Especial
SUPERGASBRAS ENERGIA LTDA,19.791.896/0001-00,Consumidor Especial
SUPERIOR INDUSTRIES DO BRASIL LTD,45.561.404/0001-92,Consumidor Especial
SUPERMERCADO SUPER LUNA S.A,71.385.637/0001-91,Consumidor Especial
"MARTINS &amp, MARTINS LTDA",03.790.896/0001-48,Consumidor Especial
COMERCIAL CARAPA DE SECOS E MOLHADOS LTD,03.790.904/0001-56,Consumidor Especial
SUPERMAGO COMERCIO LTDA,02.765.561/0001-07,Consumidor Especial
SUPERMERCADO BERNARDAO LTDA,18.468.199/0001-42,Consumidor Especial
"DALMORA ZANDONAI &amp, CIA LTD",76.787.977/0001-62,Consumidor Especial
SUPERMERCADO JARDIM DOS CALEGARIS LTD,54.255.906/0001-86,Consumidor Especial
SUPERMERCADO CARNEIRO LTDA,55.322.150/0001-03,Consumidor Especial
SUPERMERCADO CIDADE EIRELI,83.306.969/0001-12,Consumidor Especial
SUPERMERCADO COELHO DINIZ EIREL,41.930.199/0001-34,Consumidor Especial
COVABRA SUPERMERCADOS LTDA,61.233.151/0001-84,Consumidor Especial
SUPERMERCADO D'ORLA LTDA,01.447.569/0001-62,Consumidor Especial
LATICINIOS BOA ESPERANCA DE ARARUAMA LTD,29.840.154/0001-73,Consumidor Especial
SUPERMERCADO FLUMINENSE DE ITAPERUNA LTD,32.336.794/0001-55,Consumidor Especial
FORMOSA SUPERMERCADOS E MAGAZINE LTD,63.864.771/0001-47,Consumidor Especial
SUPERMERCADO GUANABARA S.A.,94.846.755/0001-55,Consumidor Especial
SUPERMERCADO GUARA LTDA,04.675.604/0001-99,Consumidor Especial
"GUERRO &amp, PAGNUSSAT LTDA",09.461.639/0001-49,Consumidor Especial
ITAPOA SUPERMERCADO LTDA.,06.955.576/0001-99,Consumidor Especial
SUPERMERCADO PRO BRASIL LTDA,37.629.995/0001-64,Consumidor Especial
SUPERMERCADO REAL DE NITEROI LTD,10.697.697/0001-55,Consumidor Especial
COMERCIO DOIS IRMAOS SR LTDA,79.657.540/0001-00,Consumidor Especial
SUPERMERCADO RONDON LTDA,51.010.502/0009-91,Consumidor Especial
SUPERMERCADO RONDON LTDA,51.010.502/0001-34,Consumidor Especial
ROXO - ATACADO E VAREJO LTDA,88.695.366/0001-73,Consumidor Especial
ROYAL COMERCIO E DISTRIBUIDORA LTD,08.842.314/0001-43,Consumidor Especial
SUPERMERCADOS CAMPO GRANDE LTD,26.941.332/0001-64,Consumidor Especial
I.S. COMERCIO E DISTRIBUICAO LTD,03.722.755/0001-98,Consumidor Especial
SUPERMERCADO TRIALBA LTDA.,07.128.576/0001-88,Consumidor Especial
CHAPADA COMÉRCIO DE ALIMENTOS EIREL,79.578.068/0001-02,Consumidor Especial
SUPER MERCADO ZONA SUL S A,33.381.286/0001-51,Consumidor Especial
ADICAO DISTRIBUICAO EXPRESS LTD,04.149.637/0001-03,Consumidor Especial
"ABI BELEM &amp, CIA LTDA",82.745.886/0001-67,Consumidor Especial
SUPERMERCADOS CAETANO LTDA,49.618.556/0001-35,Consumidor Especial
GERMANS DISTRIBUIDORA DE COMESTIVEIS LTD,31.210.180/0001-60,Consumidor Especial
DRIFT COMERCIO DE ALIMENTOS S/A,28.129.260/0001-80,Consumidor Especial
SUPERMERCADOS CASAGRANDE LTDA,27.473.669/0001-57,Consumidor Especial
"A.A.DE MELO &amp, CIA LTDA",53.533.386/0001-63,Consumidor Especial
"FAVETTA &amp, CIA. LTDA.",44.809.564/0001-45,Consumidor Especial
FLORESTA COMERCIO E INDUSTRIA S/A - EM RECUPERACAO JUDICIAL EM RECUPERACAO JUDICIA,32.500.977/0001-64,Consumidor Especial
CASAS GUANABARA COMESTIVEIS LTD,33.130.543/0045-01,Consumidor Especial
SUPERMERCADOS MANENTI LTDA,79.837.688/0001-19,Consumidor Especial
ORGANIZACAO MARINGA LTDA,30.805.824/0001-08,Consumidor Especial
COMERCIO DE GENEROS ALIMENTICIOS PARANA LTD,06.959.577/0001-01,Consumidor Especial
DIAS PASTORINHO S A COMERCIO E INDUSTRI,61.192.795/0001-71,Consumidor Especial
"GUSTO &amp, HENRI SUPERMERCADOS LTD",05.593.000/0001-66,Consumidor Especial
SUPERMERCADOS SCHUTZE LTDA,86.378.866/0001-56,Consumidor Especial
SUPERMERCADOS VIANENSE LTDA,27.881.408/0001-76,Consumidor Especial
SUPERMERCADO SUPERPAO LTDA,77.883.320/0001-61,Consumidor Especial
PAX SUPERMERCADOS LTDA.,03.951.550/0001-84,Consumidor Especial
SUPERPRIX LOJAS DE ALIMENTOS LTD,02.618.563/0001-73,Consumidor Especial
MERCANTIL BASTOS LTDA,18.060.525/0001-88,Consumidor Especial
CONDOMINIO PRO INDIVISO DO SUPERSHOPPING OSASC,08.174.968/0001-46,Consumidor Especial
SUPERTEC EQUIPAMENTOS DE PROTECAO EIREL,03.310.062/0001-98,Consumidor Especial
SUPERTRAT INDUSTRIA E COMERCIO DE PRODUTOS METALURGICOS LTD,00.016.037/0001-08,Consumidor Especial
SUPERVI DISTRIBUIDOR DE ALIMENTOS LTD,07.503.617/0001-79,Consumidor Especial
SUPERVIZA SUPERMERCADOS LTDA,05.435.073/0001-20,Consumidor Especial
SUPLAY COMPONENTES E SUPRIMENTO LTD,93.640.506/0001-46,Consumidor Especial
SUPREMA INDUSTRIA E COMERCIO DE VIDROS LTD,21.825.164/0001-28,Consumidor Especial
SURFACE PEDRAS DO BRASIL EIRELI,33.961.852/0001-02,Consumidor Especial
SUSIN FRANCESCUTTI METALURGICA LTD,88.628.805/0001-25,Consumidor Especial
SUVALAN SUCOS DE FRUTAS| INDUSTRIA E COMERCIO LTDA,04.123.496/0001-41,Consumidor Especial
SUVIFER INDUSTRIA E COMERCIO DE FERRO E ACO LTDA,62.088.828/0001-09,Consumidor Especial
SUZANPECAS INDUSTRIA METALURGICA EIREL,55.020.952/0001-69,Consumidor Especial
SHERWIN-WILLIAMS DO BRASIL INDUSTRIA E COMERCIO LTDA,60.872.306/0040-76,Consumidor Especial
SW INDUSTRIA E COMERCIO DE ALIMENTOS LTD,13.042.032/0001-00,Consumidor Especial
STEEL WAREHOUSE CISA INDUSTRIAS DE ACO LTDA,21.109.652/0001-39,Consumidor Especial
GK 108 INDUSTRIAL DE PARTES DE AUTO PECAS S/,06.879.489/0003-61,Consumidor Especial
