Razão social,CNPJ,Classificação
1001 INDUSTRIA DE ARTEFATOS DE BORRACHA LTD,61.508.537/0001-51,Consumidor Especial
163 BEEF INDUSTRIA E COMERCIO DE CARNES LTD,11.610.856/0002-86,Consumidor Especial
2RL COMERCIO E INDUSTRIA DE BOMBAS HIDRAULICAS LTD,07.852.102/0001-84,Consumidor Especial
TRES CORACOES ALIMENTOS S.A.,63.310.411/0014-18,Consumidor Especial
3M DO BRASIL LTDA,45.985.371/0001-08,Consumidor Especial
3M MANAUS INDUSTRIA DE PRODUTOS QUIMICOS LTD,08.014.346/0001-50,Consumidor Especial
3PL BRASIL LOGISTICA S.A.,23.429.671/0001-78,Consumidor Especial
43 SA GRAFICA E EDITORA,82.641.606/0001-70,Consumidor Especial
8 EMBALAGENS PLASTICAS EIRELI,11.032.345/0001-43,Consumidor Especial
9INJET INJECAO DE PECAS PLASTICAS LTDA,07.591.645/0001-95,Consumidor Especial
FUNDICAO BORGHETTI LTDA,93.866.531/0001-42,Consumidor Especial
PARAGUACU TEXTIL LTDA,96.368.816/0002-22,Consumidor Especial
A. RAYMOND BRASIL LTDA,01.144.384/0001-89,Consumidor Especial
ASSOCIACAO ATLETICA BANCO DO BRASIL - SAO PAUL,61.049.250/0001-00,Consumidor Especial
A ABREU BENEFICIAMENTOS LTDA,01.585.178/0001-04,Consumidor Especial
AARC EMPREENDIMENTOS IMOBILIARIOS LTD,07.563.445/0001-29,Consumidor Especial
AB COMERCIO DE INSUMOS LTDA,81.175.416/0001-42,Consumidor Especial
AB SISTEMA DE FREIOS LTDA,13.625.300/0001-08,Consumidor Especial
AB PLAST MANUFATURADOS PLASTICOS LTD,76.343.748/0001-59,Consumidor Especial
ABATEDOURO BOM JESUS LTDA,77.606.911/0001-91,Consumidor Especial
VEREDA ALIMENTOS LTDA,04.454.667/0001-15,Consumidor Especial
ABAV-ABATEDOURO ATILIO VIVACQUA LTD,02.838.996/0001-34,Consumidor Especial
ABB POWER GRIDS BRASIL LTDA.,61.074.829/0001-23,Consumidor Especial
ABB AUTOMACAO LTDA,33.449.965/0001-15,Consumidor Especial
ABB ELETRIFICACAO LTDA,33.449.988/0001-20,Consumidor Especial
ABBASPEL INDUSTRIA E COMERCIO DE PAPEIS LTDA,04.490.046/0001-97,Consumidor Especial
ABBOTT LABORATORIOS DO BRASIL LTD,56.998.701/0001-16,Consumidor Especial
ABC ARTEFATOS DE BORRACHA COELHO LTD,18.422.469/0001-84,Consumidor Especial
ABC GROUP DO BRASIL LTDA,02.679.320/0001-45,Consumidor Especial
AGUSTINI MATEUS DO ABC INDUSTRIA E COMERCIO DE VIDROS LTD,27.208.273/0001-82,Consumidor Especial
ASSOCIACAO BRASILEIRA DE EDUCACAO E CULTURA -ABE,60.982.352/0001-11,Consumidor Especial
ABES - SOCIEDADE BAIANA DE ENSINO SUPERIOR LTD,32.697.294/0001-49,Consumidor Especial
ABIMAR SUPERMERCADOS LTDA,00.508.070/0001-55,Consumidor Especial
ACADEMIA BRASILEIRA DE LETRAS,40.262.404/0001-78,Consumidor Especial
FMC ENERGIA LTDA,35.585.168/0001-90,Consumidor Especial
A BUHLER SA CURTUME,89.716.583/0001-65,Consumidor Especial
"BELLO FRUTO INDUSTRIA| COMERCIO| IMPORTACAO &amp, EXPORTACAO DE POLPAS DA AMAZONIA LTD",21.544.666/0001-80,Consumidor Especial
ACAI DA AMAZONIA EXPORTADORA DE BEBIDAS LTD,09.326.526/0001-30,Consumidor Especial
MACUNAIMA AGROINDUSTRIA E COMERCIO DE POLPAS LTD,06.246.487/0001-73,Consumidor Especial
ACAI PARAENSE IND. E COM. DE ALIMENTOS IMPORTACAO E EXPORTACAO LTD,20.318.219/0001-40,Consumidor Especial
CASTANHAL COM. DE POLPAS LTDA,07.166.434/0001-05,Consumidor Especial
HOTELARIA ACCOR BRASIL S/A,09.967.852/0001-27,Consumidor Especial
HHR BT RIO DE JANEIRO INVESTIMENTOS HOTELEIROS LTD,15.051.092/0001-06,Consumidor Especial
HOTELARIA ACCORINVEST BRASIL S.,02.419.765/0001-96,Consumidor Especial
ACE SCHMERSAL ELETROELETRONICA INDUSTRIAL LTD,61.854.147/0001-33,Consumidor Especial
ACEF S/A.,46.722.831/0001-78,Consumidor Especial
ACETECH INDUSTRIA E COMERCIO DE EMBALAGENS E ADESIVOS EIREL,67.184.853/0001-00,Consumidor Especial
CERDIA BRASIL INDUSTRIA E COMERCIO LTDA,07.794.384/0001-00,Consumidor Especial
ACG DO BRASIL S/A,09.625.967/0002-14,Consumidor Especial
ASSOCIACAO CIVIL DOS PROPRIETARIOS E LOCATARIOS DO CENTRO EMPRESARIAL GWES,34.954.956/0001-44,Consumidor Especial
ACOPECAS INDUSTRIA DE PECAS DE ACO LTD,75.883.975/0001-04,Consumidor Especial
ACOFER INDUSTRIA E COMERCIO EIREL,03.989.217/0003-26,Consumidor Especial
ACOFERGO TUBOS E PERFILADOS LTD,06.881.776/0001-44,Consumidor Especial
ACOFORJA INDUSTRIA DE FORJADOS S,16.716.417/0001-95,Consumidor Especial
ACOKORTE IND METALURGICA E COMERCIO LTD,66.081.894/0001-08,Consumidor Especial
ACOME DO BRASIL LTDA.,02.554.135/0001-24,Consumidor Especial
ACOS VIC LTDA,60.608.866/0001-01,Consumidor Especial
ACOSTUMADO ALIMENTOS LTDA,22.907.158/0001-82,Consumidor Especial
ACOTEL INDUSTRIA E COMERCIO LTD,22.719.686/0001-08,Consumidor Especial
ACOTUBO INDUSTRIA E COMERCIO LTD,43.919.968/0001-29,Consumidor Especial
A.C.P. INDUSTRIA DE MOVEIS LTD,30.746.945/0001-18,Consumidor Especial
ACPA ANODIZACAO DE CHAPAS E PERFIS DE ALUMINIO LTD,01.945.472/0001-80,Consumidor Especial
ACRILEX TINTAS ESPECIAIS S,60.779.014/0001-87,Consumidor Especial
ACRILYS DO BRASIL LAMINADOS PLASTICOS LTD,93.831.832/0001-30,Consumidor Especial
ACRILYS DO BRASIL LAMINADOS PLASTICOS LTD,93.831.832/0002-11,Consumidor Especial
ASSOCIACAO CONGREGACAO DE SANTA CATARIN,60.922.168/0001-86,Consumidor Especial
ACTEGA DO BRASIL TINTAS E VERNIZES LTDA,03.687.143/0010-00,Consumidor Especial
MOURA BATERIAS AUTOMOTIVAS E INDUSTRIAIS - COMERCIO| EXPORTACAO E IMPORTACAO LTD,15.459.513/0001-32,Consumidor Especial
ACUMENT BRASIL SISTEMAS DE FIXACAO S.A,61.526.836/0001-19,Consumidor Especial
ADAMA BRASIL S/A,02.290.510/0001-76,Consumidor Especial
ADAR INDUSTRIA | COMERCIO IMPORTACAO E EXPORTACAO LTD,03.442.526/0001-10,Consumidor Especial
ADASEBO-INDUSTRIA E COMERCIO DE PRODUTOS ANIMAIS LTD,71.966.071/0001-91,Consumidor Especial
ADATA INTEGRATION BRAZIL S/A,21.316.324/0001-03,Consumidor Especial
ADATEX S A INDUSTRIAL E COMERCIAL,50.464.734/0001-08,Consumidor Especial
ADDN ASSISTENCIA TECNICA COMERCIO E INDUSTRIA LTD,71.774.004/0001-75,Consumidor Especial
ADECOL INDUSTRIA QUIMICA LTDA,50.851.955/0001-20,Consumidor Especial
ADEL COCO BRASIL INDUSTRIA E COMERCIO LTD,10.567.693/0001-52,Consumidor Especial
ADELBRAS INDUSTRIA E COMERCIO DE ADESIVOS LTD,73.077.299/0001-56,Consumidor Especial
ADERE PRODUTOS AUTO ADESIVOS LTD,46.062.030/0001-23,Consumidor Especial
EMBALAGENS INDUSTRIAIS ADESI COATING LTDA,11.325.407/0001-05,Consumidor Especial
ADESTE INDUSTRIA DE PRODUTOS ANIMAIS LTD,44.885.291/0001-18,Consumidor Especial
ADESTE PRODUTOS ANIMAIS E VEGETAIS LTD,43.563.840/0005-07,Consumidor Especial
ADF - EMPRESAS REUNIDAS LTDA,10.508.274/0001-40,Consumidor Especial
ARROZEIRA ADIB PEIXOTO LTDA,04.908.287/0001-03,Consumidor Especial
ADIENT DO BRASIL BANCOS AUTOMOTIVOS LTDA,00.514.820/0001-00,Consumidor Especial
ADIMAX - INDUSTRIA E COMERCIO DE ALIMENTOS LTDA,03.887.324/0012-34,Consumidor Especial
ADIMAX - INDUSTRIA E COMERCIO DE ALIMENTOS LTDA,03.887.324/0006-96,Consumidor Especial
ADIMAX - INDUSTRIA E COMERCIO DE ALIMENTOS LTDA,03.887.324/0002-62,Consumidor Especial
ADLER PTI S.A.,00.673.500/0001-94,Consumidor Especial
AD'ORO S.A.,60.037.058/0001-31,Consumidor Especial
ADUFERTIL FERTILIZANTES LTDA.,44.777.951/0001-47,Consumidor Especial
LABORATORIO TAYUYNA LTDA,60.879.848/0001-64,Consumidor Especial
ADVAL TECH DO BRASIL INDUSTRIA DE AUTOPECAS LTDA,03.284.033/0001-07,Consumidor Especial
ASSEMBLEIA DE DEUS VITORIA EM CRIST,34.292.797/0001-60,Consumidor Especial
ASSOCIACAO EVANGELICA BENEFICENTE ESPIRITO-SANTENSE - AEBE,28.127.926/0001-61,Consumidor Especial
ASSOCIACAO EVANGELICA BENEFICENTE ESPIRITO-SANTENSE - AEBE,28.127.926/0002-42,Consumidor Especial
AEC CENTRO DE CONTATOS S/A,02.455.233/0001-04,Consumidor Especial
AEL SISTEMAS S.A,88.031.539/0001-59,Consumidor Especial
ASSOCIACAO DE ENSINO E CULTURA DE MATO GROSSO DO SU,01.923.317/0001-62,Consumidor Especial
AERIS INDUSTRIA E COMERCIO DE EQUIPAMENTOS PARA GERACAO DE ENERGIA S.,12.528.708/0001-07,Consumidor Especial
AERNNOVA AEROSPACE DO BRASIL EIREL,06.184.630/0001-40,Consumidor Especial
SPE CONCESSIONARIA AEROESTE AEROPORTOS S.A,34.331.544/0001-58,Consumidor Especial
SPE CONCESSIONARIA DO AEROPORTO DE ILHEUS S/,31.840.260/0001-07,Consumidor Especial
AESA AUTOMOLAS EQUIPAMENTOS LTDA,60.446.929/0001-70,Consumidor Especial
ASSOCIACAO EDUCADORA SAO CARLOS - AES,88.625.686/0001-57,Consumidor Especial
ASSOCIACAO EDUCADORA SAO CARLOS - AES,88.625.686/0024-43,Consumidor Especial
AETHRA SISTEMAS AUTOMOTIVOS S.A,41.757.527/0001-42,Consumidor Especial
ASSOCIACAO FUNDO DE INCENTIVO A PESQUIS,47.673.793/0001-73,Consumidor Especial
ACEARIA FREDERICO MISSNER LTD,82.719.956/0001-02,Consumidor Especial
AGCM CONSTRUTORA E MINERADORA LTD,88.245.402/0001-05,Consumidor Especial
AGCO DO BRASIL SOLUCOES AGRICOLAS LTDA,55.962.369/0012-20,Consumidor Especial
AGCO DO BRASIL SOLUCOES AGRICOLAS LTDA,55.962.369/0017-34,Consumidor Especial
GSI BRASIL INDUSTRIA E COMERCIO DE EQUIPAMENTOS AGROPECUARIOS LTD,01.770.039/0001-50,Consumidor Especial
AGEL ANEIS GAXETAS EQUIPAMENTOS LTD,51.938.702/0001-51,Consumidor Especial
ARMAZENS GERAIS LESTE DE MINAS LIMITAD,17.370.354/0001-20,Consumidor Especial
AGM INDUSTRIA E COMERCIO DE EMBALAGENS LTD,01.070.163/0001-03,Consumidor Especial
AGRA AGROINDUSTRIAL DE ALIMENTOS S,24.746.687/0001-77,Consumidor Especial
AGRALE SOCIEDADE ANONIMA,88.610.324/0001-92,Consumidor Especial
AGRICHEM DO BRASIL S.A.,03.860.998/0001-92,Consumidor Especial
AGRICOLA FAMOSA S.A.,00.474.300/0001-02,Consumidor Especial
AGRICOLA HORIZONTE LTDA,77.837.979/0001-81,Consumidor Especial
AGRIFIRM DO BRASIL NUTRICAO ANIMAL LTD,03.279.946/0001-27,Consumidor Especial
AGRIMIG CALCARIO AGRICOLA LIMITAD,21.580.469/0001-17,Consumidor Especial
AGRITECH LAVRALE INDUSTRIA DE MAQUINARIO AGRICOLA E COMPONENTES LTD,88.658.984/0001-43,Consumidor Especial
AGROINDUSTRIAL IGUATEMI EIRELI,12.593.115/0001-16,Consumidor Especial
AGRO INDUSTRIAL ITUBERA LTDA,13.543.822/0001-60,Consumidor Especial
AGRO LATINA LTDA,88.320.536/0001-35,Consumidor Especial
AGRO NORTE PESQUISA E SEMENTES LTD,03.503.798/0001-82,Consumidor Especial
AGROPRATINHA S/A,82.270.893/0002-30,Consumidor Especial
INDUSTRIA AGRO-PERTENCES EIRELI,87.760.062/0001-80,Consumidor Especial
AGROARACA INDUSTRIA DE ALIMENTOS LTD,04.239.719/0001-30,Consumidor Especial
AGROAVES LTDA,17.868.142/0001-78,Consumidor Especial
AGRO BOI IMPORTACAO E EXPORTACAO LTD,04.119.970/0001-61,Consumidor Especial
AGROFEL AGRO COMERCIAL S.A.,03.415.222/0001-63,Consumidor Especial
AGROGEN DESENVOLVIMENTO GENETICO S.A,32.593.445/0001-19,Consumidor Especial
AGROPECUARIA MAGGI LTDA,00.315.457/0001-95,Consumidor Especial
AGROMANTOVA LTDA,23.768.921/0001-02,Consumidor Especial
INDUSTRIAS XHARA LTDA,18.866.111/0001-40,Consumidor Especial
AGROPARR ALIMENTOS LTDA,93.607.398/0001-00,Consumidor Especial
AGROPECUARIA CRESTANI LTDA,03.262.185/0001-09,Consumidor Especial
AGROPLASTIC COMERCIAL DE PLASTICOS LTD,14.810.613/0001-07,Consumidor Especial
AGROQUIMA PRODUTOS AGROPECUARIOS LTD,01.626.951/0001-33,Consumidor Especial
AGROSEPAC SERRADOS LTDA,29.116.865/0001-08,Consumidor Especial
AGROSPE - AGRO INDUSTRIAL SAO PEDRO DE VACARIA LTD,91.816.538/0001-24,Consumidor Especial
AGROTERENAS S.A. INDUSTRIAL CITRU,08.079.184/0001-39,Consumidor Especial
ARMAZENS GERAIS TERMINAL LTDA,81.174.138/0001-09,Consumidor Especial
MINERADORA DE AGUA ANA ROSA LTD,07.976.975/0001-07,Consumidor Especial
HIDROMINERAL LA BANANAL LTDA,10.654.793/0001-16,Consumidor Especial
MINERADORA  AGUA BRANCA LTDA,19.347.955/0001-48,Consumidor Especial
SETA AGRO-MINERACAO LTDA,17.881.855/0001-71,Consumidor Especial
EPD - INDUSTRIA E COMERCIO DE AGUA MINERAL EIREL,07.649.214/0001-32,Consumidor Especial
MINERACAO AGUA PADRE MANOEL LTD,17.315.060/0001-04,Consumidor Especial
AGUAS DAS AGULHAS NEGRAS S.A,09.195.493/0001-37,Consumidor Especial
AGUAS DE CASA BRANCA SPE LTDA.,29.313.891/0001-18,Consumidor Especial
AGUAS DE JAHU S/A,20.918.034/0001-77,Consumidor Especial
CONCESSIONARIA AGUAS DE JUTURNAIBA S/,02.013.199/0001-18,Consumidor Especial
AGUAS DE MATAO S.A,19.190.721/0001-30,Consumidor Especial
AGUAS DE NITEROI S/A,02.150.336/0001-66,Consumidor Especial
AGUAS DE NOVA FRIBURGO LTDA.,03.119.806/0001-91,Consumidor Especial
AGUAS DE PARA DE MINAS S/A.,18.494.424/0001-15,Consumidor Especial
AGUAS DE VOTORANTIM S/A,14.192.039/0001-62,Consumidor Especial
AGUAS DO IMPERADOR SA,02.150.327/0001-75,Consumidor Especial
AGUAS DO MIRANTE S.A.,15.384.637/0001-04,Consumidor Especial
AGUAS DO PARAIBA SA,01.280.003/0001-99,Consumidor Especial
FIACAO AGUAS NEGRAS LTDA,80.096.050/0001-53,Consumidor Especial
AGUAS NEGRAS SA INDUSTRIA DE PAPE,82.757.907/0001-64,Consumidor Especial
AGUAS PETROPOLIS PAULISTA LTD,61.072.898/0001-06,Consumidor Especial
AGUAS PRATA LTDA,60.344.173/0001-59,Consumidor Especial
AGUAS MINERAIS SARANDI LTDA,97.318.943/0001-07,Consumidor Especial
AGUATIVA GOLF RESORT S/A,77.424.992/0002-90,Consumidor Especial
AGUIA SISTEMAS DE ARMAZENAGEM S/,81.075.137/0001-07,Consumidor Especial
VIACAO AGUIA BRANCA S A,27.486.182/0001-09,Consumidor Especial
AGV LOGISTICA S.A,02.905.424/0001-20,Consumidor Especial
AHLSTROM-MUNKSJO BRASIL INDUSTRIA E COMERCIO DE PAPEIS ESPECIAIS LTDA,00.767.144/0001-78,Consumidor Especial
AIRELA INDUSTRIA FARMACEUTICA LTD,01.858.973/0001-29,Consumidor Especial
AIRO INDUSTRIA E COMERCIO DE EMBALAGENS EIREL,10.305.157/0001-89,Consumidor Especial
AISIN AUTOMOTIVE LTDA.,14.011.603/0001-01,Consumidor Especial
A.J. BENEFICIAMENTO TEXTIL LTD,02.548.987/0001-09,Consumidor Especial
AJN CONFECCOES LTDA,13.459.933/0001-93,Consumidor Especial
AKEO INDUSTRIAL LTDA,89.340.921/0001-07,Consumidor Especial
AKER SOLUTIONS DO BRASIL LTDA,05.876.349/0001-05,Consumidor Especial
AKG DO BRASIL - DESENVOLVIMENTO E COMERCIALIZACAO DE SISTEMAS TERMODINAMICOS LTD,13.461.781/0001-63,Consumidor Especial
707 AUTO-SERVICO DE ALIMENTOS LTD,12.539.517/0001-32,Consumidor Especial
AKZO NOBEL LTDA,60.561.719/0001-23,Consumidor Especial
AKZO NOBEL LTDA,60.561.719/0094-22,Consumidor Especial
ALBAN INDUSTRIA E COMERCIO DE EMBALAGENS PLASTICAS LTD,66.908.955/0001-50,Consumidor Especial
ALBANY INTERNATIONAL TECIDOS TECNICOS LTDA,60.580.263/0001-49,Consumidor Especial
ALBAUGH AGRO BRASIL LTDA.,01.789.121/0001-27,Consumidor Especial
SILGAN DISPENSING SYSTEMS AND PACKAGING DO BRASIL INDUSTRIA DE EMBALAGENS LTDA,60.760.642/0001-10,Consumidor Especial
ALBERFLEX INDUSTRIA DE MOVEIS LTD,60.656.774/0001-05,Consumidor Especial
ALBERT SABIN HOSPITAL E MATERNIDADE LTD,04.275.687/0001-29,Consumidor Especial
ALBERTO SA INDUSTRIA E COMERCIO,10.806.453/0001-63,Consumidor Especial
METALURGICA ALBRAS LTDA,43.730.415/0001-23,Consumidor Especial
FUNDICAO ALCA LTDA,88.582.291/0001-14,Consumidor Especial
ALCABRAS INDUSTRIA E COMERCIO LTD,06.110.207/0001-03,Consumidor Especial
ALCAPLAS INDUSTRIA DE PLASTICOS LTD,03.943.986/0001-21,Consumidor Especial
ALCATEC PRODUTOS SINTETICOS LTD,05.236.060/0001-21,Consumidor Especial
ALDEIA DAS AGUAS PARK RESORT,39.204.391/0001-00,Consumidor Especial
ALDORO INDUSTRIA DE POS E PIGMENTOS METALICOS LTD,47.340.930/0001-58,Consumidor Especial
ALEMOLDE INDUSTRIA E COMERCIO DE EMBALAGENS DE MATERIAL PLASTICO LTD,10.344.758/0001-09,Consumidor Especial
ALEPLAST EMBALAGENS PLASTICAS LTDA,01.737.383/0001-48,Consumidor Especial
ALESTIS DO BRASIL INDUSTRIA  AEROESPACIAL LTD,09.071.368/0001-15,Consumidor Especial
ALFA LAVAL LTDA.,43.474.212/0003-85,Consumidor Especial
ALFAGOMMA DO BRASIL LTDA,15.445.004/0001-50,Consumidor Especial
CERAMICA ALFAGRES INDUSTRIA E COMERCIO LTD,01.703.119/0001-93,Consumidor Especial
ALFLEN E ALFLEN LTDA,19.205.227/0001-00,Consumidor Especial
ALGAR TECNOLOGIA E CONSULTORIA S.A,21.246.699/0001-44,Consumidor Especial
ALGAR TELECOM S/A,71.208.516/0001-74,Consumidor Especial
ALGAR MULTIMIDIA S/A,04.622.116/0001-13,Consumidor Especial
LATICINIOS ALHAMBRA LTDA,19.728.492/0001-64,Consumidor Especial
ALHENA COLOR ANODIZACAO LTDA.,09.321.053/0001-89,Consumidor Especial
ALIANCA S/A - INDUSTRIA NAVAL E EMPRESA DE NAVEGACA,33.055.732/0008-04,Consumidor Especial
ALIANZA LOGISTICA E EMPREENDIMENTOS LTD,08.776.680/0001-41,Consumidor Especial
ALIBEM ALIMENTOS S.A.,03.941.052/0001-50,Consumidor Especial
ALIBEY INDUSTRIA E COMERCIO DE ALIMENTOS ESPECIAIS LTD,74.526.278/0005-67,Consumidor Especial
ALIBRA INGREDIENTES LTDA,03.645.657/0001-02,Consumidor Especial
ALIBRAS - ALIMENTOS BRASILEIROS LTD,78.328.051/0001-34,Consumidor Especial
ALIMENTOS DALLAS INDUSTRIA E COMERCIO LTD,03.938.789/0003-86,Consumidor Especial
ALIMENTA NUTRICAO ANIMAL LTDA.,22.458.798/0001-52,Consumidor Especial
ALIMENTOS ESTRELA LTDA,04.279.743/0001-01,Consumidor Especial
"S. MANOEL FAGUNDES &amp, CIA LTD",09.481.584/0001-39,Consumidor Especial
ALIMENTOS JURITI LTDA,77.966.570/0001-65,Consumidor Especial
FECULARIA LOPES LTDA,74.175.159/0001-83,Consumidor Especial
ALISUL ALIMENTOS SA,89.548.523/0024-77,Consumidor Especial
ALISUL ALIMENTOS SA,89.548.523/0014-03,Consumidor Especial
ALISUL ALIMENTOS SA,89.548.523/0042-59,Consumidor Especial
ALISUL ALIMENTOS SA,89.548.523/0001-80,Consumidor Especial
ALL NUTRI ALIMENTOS EIRELI,05.965.693/0001-70,Consumidor Especial
ALL4LABELS GRAFICA DO BRASIL LTD,82.637.109/0001-07,Consumidor Especial
EMBALAGENS ALLBOX LTDA,07.570.962/0001-25,Consumidor Especial
CERAMICA   ALLEANZA  LTDA.,23.320.538/0001-89,Consumidor Especial
ALLERGAN PRODUTOS FARMACEUTICOS LTDA,43.426.626/0009-24,Consumidor Especial
SISTEMAS DE IDENTIFICACAO ANIMAL LTD,05.194.267/0001-80,Consumidor Especial
ALLIAGE S/A INDUSTRIAS MEDICO ODONTOLOGIC,55.979.736/0001-45,Consumidor Especial
ALLIANCE QUIMICA INDUSTRIA E COMERCIO LTD,14.980.121/0001-51,Consumidor Especial
ALLNEX QUIMICA BRASIL LTDA,81.676.124/0001-93,Consumidor Especial
ALLTAPE INDUSTRIA E COMERCIO DE FITAS ADESIVAS LTD,03.250.204/0001-79,Consumidor Especial
ALMAVIVA DO BRASIL TELEMARKETING E INFORMATICA S/,08.174.089/0001-14,Consumidor Especial
ALMEIDA MERCADOS - COMERCIO| DISTRIBUIDORA E IMPORTADORA LTD,77.728.988/0001-34,Consumidor Especial
ALPARGATAS S.A.,61.079.117/0001-05,Consumidor Especial
ALPES INDUSTRIA E COMERCIO DE PLASTICOS EIREL,02.877.500/0001-31,Consumidor Especial
ALPEX ALUMINIO S.A,68.100.064/0001-06,Consumidor Especial
ALPHA INDUSTRIA METALURGICA LTD,04.139.977/0001-45,Consumidor Especial
ALPHA PLAST-INDUSTRIA E COMERCIO LTD,03.357.873/0001-44,Consumidor Especial
ALPHAVILLE TENIS CLUBE,48.745.913/0001-63,Consumidor Especial
ALPINO INDUSTRIA METALURGICA LTD,61.451.027/0001-95,Consumidor Especial
A L PLAST INDUSTRIA E COMERCIO DE PLASTICOS EIREL,11.108.619/0001-30,Consumidor Especial
ALSCO TOALHEIRO BRASIL LTDA.,33.325.184/0001-19,Consumidor Especial
ALSCO TOALHEIRO BRASIL LTDA.,33.325.184/0028-39,Consumidor Especial
ALSCO TOALHEIRO BRASIL LTDA.,33.325.184/0020-81,Consumidor Especial
ALSTOM BRASIL ENERGIA E TRANSPORTE LTD,88.309.620/0001-58,Consumidor Especial
ALTA VISTA THERMAS RESORT,30.405.185/0001-85,Consumidor Especial
A.T.P. INDUSTRIA E COMERCIO DE PLASTICOS LTDA,04.995.392/0001-27,Consumidor Especial
ASTI S/A,04.649.260/0001-43,Consumidor Especial
ALTECNICA INDUSTRIA E COMERCIO LTD,93.719.136/0003-07,Consumidor Especial
ALTENBURG TEXTIL LTDA,75.293.662/0001-04,Consumidor Especial
ALTERNATIVA COMPONENTES LTDA,04.572.201/0001-14,Consumidor Especial
ALTERO DESIGN - INDUSTRIA E COMERCIO LTDA,89.790.356/0001-80,Consumidor Especial
EDITORA ALTEROSA LTDA,17.181.488/0001-01,Consumidor Especial
ALTHOFF SUPERMERCADOS LTDA,83.646.604/0001-37,Consumidor Especial
LATICINIO DANIEL COLLE LTDA,04.421.375/0001-86,Consumidor Especial
ALTOM METALURGIA LTDA,07.502.359/0001-06,Consumidor Especial
ALTOM INDUSTRIA E COMERCIO DE IMAS LTD,36.448.573/0001-20,Consumidor Especial
ALUCOMAXX BRASIL - INDUSTRIA E COMERCIO DE REVESTIMENTOS LTD,12.047.030/0001-32,Consumidor Especial
ALUDIM ALUMINIO LTDA,13.280.501/0001-10,Consumidor Especial
ANODIZACAO E COLORACAO DE METAIS MARINGA LTD,00.684.513/0001-69,Consumidor Especial
ALUDYNE COMPONENTES AUTOMOTIVOS BRASIL LTDA,02.221.397/0001-77,Consumidor Especial
ALUMASA INDUSTRIA DE PLASTICO E ALUMINIO LTD,80.718.984/0001-80,Consumidor Especial
ALUMAX EXTRUSAO DE METAIS LTD,11.740.881/0001-01,Consumidor Especial
ALUMBRA PRODUTOS ELETRICOS E ELETRONICOS LTD,59.114.777/0001-20,Consumidor Especial
FUNDICAO ALUMETAF LTDA,73.954.489/0001-04,Consumidor Especial
ALUMICONTE COMPONENTES DE ALUMINIO EIREL,92.175.892/0001-80,Consumidor Especial
ALUMINIO ARARAS LTDA,51.045.029/0001-20,Consumidor Especial
"NEVIO &amp, MOYA ARTEFATOS DE ALUMINIO LTD",61.576.807/0001-61,Consumidor Especial
ALUMINIO MARCOLAR LTDA,43.066.372/0001-23,Consumidor Especial
ALUMINIO RAMOS INDUSTRIA E COMERCIO LTD,45.273.406/0001-86,Consumidor Especial
ALUMISO PERFIS DE ALUMINIO LTD,09.210.706/0001-52,Consumidor Especial
ALUZINCO INDUSTRIA E COMERCIO DE METAIS LTD,19.550.113/0001-99,Consumidor Especial
ALVO COMERCIO DE ALIMENTOS E UTILIDADES LTD,35.776.776/0001-82,Consumidor Especial
"MAGLIONI RIBEIRO &amp, CIA LTD",21.414.958/0001-07,Consumidor Especial
ARCELORMITTAL GONVARRI BRASIL PRODUTOS SIDERURGICOS S/,02.235.994/0001-50,Consumidor Especial
AMAFIL INDUSTRIA E COMERCIO DE ALIMENTOS LTD,75.784.140/0001-05,Consumidor Especial
NHSILVA INDUSTRIA E EXPORTACAO LTD,12.082.881/0001-16,Consumidor Especial
IRMAOS AMALCABURIO LTDA,88.623.996/0001-32,Consumidor Especial
AMALFI INDUSTRIA TEXTIL LTDA.,10.227.955/0001-30,Consumidor Especial
AMARAL COSTA MEDICINA DIAGNOSTICA S/E LTD,04.572.038/0001-90,Consumidor Especial
AMAZONAS INDUSTRIAS ALIMENTICIAS S A AMAS,05.574.041/0001-05,Consumidor Especial
AMAZON TEMPER INDUSTRIA E COMERCIO DE VIDROS TEMPERADOS LTD,09.177.724/0001-80,Consumidor Especial
AMAZON INDUSTRIA DE GELO E BEBIDAS LTD,02.402.867/0001-07,Consumidor Especial
AMAZON MIX EIRELI,22.708.749/0001-20,Consumidor Especial
AMAZON POLPAS IND. E COM. DE POLPAS DA AMAZONIA LTD,07.620.120/0001-30,Consumidor Especial
AMAZON TEMPER-INDUSTRIA| COMERCIO E SERVICOS LTD,05.744.189/0002-21,Consumidor Especial
AMAZON TEMPER INDUSTRIA DE VIDROS TEMPERADOS LTD,12.458.237/0001-08,Consumidor Especial
AMAZONAS INDUSTRIA E COMERCIO LTD,47.959.697/0001-96,Consumidor Especial
CONDOMINIO AMAZONAS SHOPPING CENTE,63.691.570/0001-95,Consumidor Especial
AMAZONFLEX INDUSTRIA E COMERCIO DE EMBALAGENS LTD,08.000.253/0001-77,Consumidor Especial
AMAZONGAS DISTRIB DE GAS LIQUEF DE PETROLEO LTD,04.957.650/0001-80,Consumidor Especial
CERVEJARIA ZX S.A.,01.131.570/0001-83,Consumidor Especial
AMBIENTE VERDE INDUSTRIA LTDA,14.892.407/0001-85,Consumidor Especial
ARCELORMITTAL CONTAGEM S.A,25.878.901/0001-01,Consumidor Especial
A.M.C. TEXTIL LTDA.,75.364.570/0007-55,Consumidor Especial
AMCOR EMBALAGENS DA AMAZONIA LTDA,84.127.208/0001-66,Consumidor Especial
AMCOR FLEXIBLES BRASIL LTDA,05.818.423/0001-37,Consumidor Especial
AMCOR PACKAGING DO BRASIL LTD,43.235.795/0001-20,Consumidor Especial
AMENDOAS DO BRASIL LTDA,03.196.885/0001-34,Consumidor Especial
AMENDUPA PRODUTOS ALIMENTICIOS LTD,48.349.526/0001-08,Consumidor Especial
AMERICA MEDICAL LTDA,01.310.212/0001-38,Consumidor Especial
AMERICAN GLASS PRODUCTS DO BRASIL LTD,01.483.048/0001-60,Consumidor Especial
AMERICAN MEDICAL INDUSTRIA TEXTIL LTD,10.403.238/0001-11,Consumidor Especial
CONDOMINIO JARDIM DAS AMERICAS SHOPPING CENTE,02.597.043/0001-21,Consumidor Especial
AMERICAS COPACABANA HOTEL LTD,22.465.567/0001-76,Consumidor Especial
AMG BRASIL S.A.,11.224.676/0001-85,Consumidor Especial
A M G COMERCIO DE PLASTICOS EIREL,07.657.468/0001-00,Consumidor Especial
AMICO SAUDE LTDA,51.722.957/0001-82,Consumidor Especial
AMIDOS BANKHARDT LTDA,06.051.661/0001-22,Consumidor Especial
AMIFEC ALIMENTOS LTDA,05.693.158/0003-70,Consumidor Especial
AMIL ASSISTENCIA MEDICA INTERNACIONAL S.A,29.309.127/0001-79,Consumidor Especial
CORLEX INDUSTRIA E COMERCIO DE PRODUTOS PLASTICOS LTD,05.826.228/0001-59,Consumidor Especial
MINASA TRADING INTERNATIONAL LTD,47.496.286/0001-01,Consumidor Especial
AMPHENOL TFC DO BRASIL LTDA,44.603.447/0001-20,Consumidor Especial
AMSTERDAN-EMBALAGENS DE PLASTICOS LTD,57.216.665/0001-54,Consumidor Especial
AMT PRODUTOS ELETRICOS S.A.,09.622.942/0001-86,Consumidor Especial
AMVIAN INDUSTRIA E COMERCIO DE PECAS AUTOMOTIVAS LTDA,11.701.069/0001-69,Consumidor Especial
AN ADMINISTRACOES E PARTICIPACOES LTD,04.060.874/0001-95,Consumidor Especial
ANABE INDUSTRIA E COMERCIO DE PROTEINAS LTD,72.282.015/0001-09,Consumidor Especial
ANACONDA INDUSTRIAL E AGRICOLA DE CEREAIS S,60.728.029/0001-16,Consumidor Especial
ANANDA METAIS LTDA,04.215.721/0001-70,Consumidor Especial
ANCORA SIDERURGICA LTDA,27.317.546/0001-27,Consumidor Especial
ANDALUZ INDUSTRIA METALURGICA LTD,03.992.026/0001-51,Consumidor Especial
ANDORINHA SUPERMERCADO LTDA,44.480.747/0001-60,Consumidor Especial
ANDRADE INDUSTRIA E COMERCIO DE MARMORES E GRANITOS LTD,31.751.233/0001-50,Consumidor Especial
ANDREANI LOGISTICA LTDA.,04.887.927/0001-46,Consumidor Especial
ANDREAZZA MADEIRAS EIRELI,76.587.989/0001-43,Consumidor Especial
"ANDREETTA &amp, CIA LTDA",87.606.372/0001-44,Consumidor Especial
FRIGORIFICO ANGELELLI LTDA,44.802.528/0001-50,Consumidor Especial
SOCIEDADE HOSPITALAR ANGELINA CARO,07.088.017/0001-91,Consumidor Especial
"A. ANGELONI &amp, CIA. LTDA",83.646.984/0001-00,Consumidor Especial
ANGLO INDUSTRIA E COMERCIO DE METAIS LTDA,66.678.459/0001-57,Consumidor Especial
"ANGOLINI &amp, ANGOLINI LTDA",44.829.653/0001-53,Consumidor Especial
ANHAMBI ALIMENTOS LTDA,78.569.688/0001-12,Consumidor Especial
ANHANGUERA EDUCACIONAL PARTICIPACOES S/,04.310.392/0001-46,Consumidor Especial
ANHANGUERA.SC EMPREENDIMENTOS IMOBILIARIOS LTD,14.266.246/0001-14,Consumidor Especial
INDUSTRIAS ANHEMBI LTDA.,55.116.131/0001-20,Consumidor Especial
ANIGER - CALCADOS| SUPRIMENTOS E EMPREENDIMENTOS LTDA,94.316.999/0001-26,Consumidor Especial
SOCIEDADE CATALANA DE EDUCACAO LTD,05.373.130/0001-93,Consumidor Especial
BRASIL EDUCACAO S/A,05.648.257/0001-78,Consumidor Especial
IEDUC - INSTITUTO DE EDUCACAO E CULTURA S/,08.446.503/0001-05,Consumidor Especial
INSTITUTO DE EDUCACAO| CULTURA E ENSINO SUPERIOR S/,44.952.711/0001-31,Consumidor Especial
