Razão social,CNPJ,Classificação
COPAZA DESCARTAVEIS PLASTICOS LTD,85.151.504/0001-65,Consumidor Especial
COPELMI MINERACAO LTDA,33.059.528/0001-95,Consumidor Especial
COOPERATIVA REGIONAL AGROPECUARIA DE CAMPOS NOVOS - COPERCAMPO,83.158.824/0001-11,Consumidor Especial
COOPERATIVA DOS PLANTADORES DE CANA DO OESTE DO ESTADO DE SAO PAUL,71.320.915/0001-22,Consumidor Especial
COOPERATIVA DE PRODUCAO E CONSUMO CONCORDI,83.573.212/0001-95,Consumidor Especial
COMPANHIA AUXILIAR DE ARMAZENS GERAI,61.145.488/0001-30,Consumidor Especial
COMPANHIA AUXILIAR DE ARMAZENS GERAI,61.145.488/0003-00,Consumidor Especial
COPOBRAS INDUSTRIA E COMERCIO DE EMBALAGENS LTDA,03.210.400/0001-10,Consumidor Especial
INDUSTRIA E COMERCIO DE PLASTICOS ZANINI LTD,01.883.423/0001-60,Consumidor Especial
COPPER INDUSTRIA E COMERCIO DE VERGALHOES EIREL,10.193.734/0001-98,Consumidor Especial
COPPERFIO INDUSTRIA E COMERCIO LTD,56.059.702/0001-03,Consumidor Especial
COPPERSTEEL BIMETALICOS LTDA,49.808.421/0001-32,Consumidor Especial
COPRA INDUSTRIA ALIMENTICIA LTD,02.736.595/0001-73,Consumidor Especial
COQUEIROS SUPERMERCADOS LTDA,94.921.301/0001-00,Consumidor Especial
CORADINI ALIMENTOS LTDA,87.675.518/0001-03,Consumidor Especial
PURAC SINTESES INDUSTRIA E COMERCIO LIMITAD,28.942.225/0002-67,Consumidor Especial
CORDEBRAS LTDA,03.872.978/0001-31,Consumidor Especial
CORDEIRO INDUSTRIA E COMERCIO DE FARINHA E GORDURA ANIMAL LTD,05.295.680/0001-31,Consumidor Especial
CORDEIRO CABOS ELETRICOS S.A.,14.197.209/0001-00,Consumidor Especial
CORDOARIA BRASIL INDUSTRIA E COMERCIO DE CORDAS EIREL,09.454.624/0001-53,Consumidor Especial
"ESTAMPARIA CORES &amp, TONS LTD",00.074.023/0001-40,Consumidor Especial
CORETEX INDUSTRIA TEXTIL LTDA,83.445.288/0001-35,Consumidor Especial
CORETRANS COMERCIAL LTDA,77.912.053/0001-03,Consumidor Especial
CORFIO INDUSTRIA E COMERCIO DE MATERIAIS ELETRICOS LTD,06.296.755/0001-61,Consumidor Especial
CORGRAF GRAFICA E EDITORA LTD,00.330.966/0001-97,Consumidor Especial
MOINHO CORINA ALIMENTOS EIRELI,08.158.596/0001-64,Consumidor Especial
COOPERATIVA RIZICOLA PITANGUEIRAS LTD,96.300.082/0001-69,Consumidor Especial
CORNING COMUNICACOES OPTICAS S.A,42.424.267/0001-56,Consumidor Especial
ABATEDOURO COROAVES LTDA,75.729.038/0001-07,Consumidor Especial
CONDOMINIO CORPORATE FINANCIAL CENTE,01.456.106/0001-67,Consumidor Especial
CORPUS SANEAMENTO E OBRAS LTD,31.733.363/0008-36,Consumidor Especial
CORR PLASTIK NORDESTE INDUSTRIAL LTD,08.984.318/0001-66,Consumidor Especial
CORRADI MAZZER TEXTIL LTDA,03.731.548/0001-08,Consumidor Especial
CORRECTA INDUSTRIA E COMERCIO LTDA,02.957.104/0001-14,Consumidor Especial
CORREIAS MERCURIO SA INDUSTRIA E COMERCI,50.937.564/0001-23,Consumidor Especial
CORRIERI ALIMENTOS LTDA.,95.592.697/0001-43,Consumidor Especial
COMPANHIA RIOGRANDENSE DE SANEAMENTO CORSA,92.802.784/0001-90,Consumidor Especial
CORTAG INDUSTRIA E COMERCIO LTDA,00.808.396/0001-06,Consumidor Especial
CORTALINA INDUSTRIAL LTDA,03.654.610/0001-05,Consumidor Especial
DOW AGROSCIENCES INDUSTRIAL LTD,47.180.625/0001-46,Consumidor Especial
INDUSTRIA DE PRODUTOS ALIMENTICIOS CORY LTD,51.665.073/0001-33,Consumidor Especial
COSAN LUBRIFICANTES E ESPECIALIDADES S.A,33.000.092/0001-69,Consumidor Especial
COMPANHIA DE SANEAMENTO DO PAR,04.945.341/0001-90,Consumidor Especial
COSENTINO LATINA LTDA,04.885.413/0001-51,Consumidor Especial
COSIMAT SIDERURGICA DE MATOZINHOS LTD,03.200.559/0001-53,Consumidor Especial
COSMA DO BRASIL PRODUTOS E SERVICOS AUTOMOTIVOS LTDA,02.591.818/0001-51,Consumidor Especial
COSMED INDUSTRIA DE COSMETICOS E MEDICAMENTOS S.A,61.082.426/0016-02,Consumidor Especial
COSMED INDUSTRIA DE COSMETICOS E MEDICAMENTOS S.A,61.082.426/0012-89,Consumidor Especial
COSPLASTIC INDUSTRIA E COMERCIO DE EMBALAGENS LTDA EM RECUPERACAO JUDICIA,37.305.471/0001-18,Consumidor Especial
COSTA MARINE INDUSTRIA E COMERCIO DE PRODUTOS ALIMENTICIOS LTDA,08.369.458/0002-05,Consumidor Especial
COSTA MULTICANAL S/A,27.289.076/0001-35,Consumidor Especial
COSTA RICA MALHAS E CONFECCOES LTD,02.944.599/0048-00,Consumidor Especial
COSTA RICA MALHAS E CONFECCOES LTD,02.944.599/0028-67,Consumidor Especial
SAUIPE S/A,00.866.577/0001-80,Consumidor Especial
COSTA SUL PESCADOS S/A,81.599.359/0001-29,Consumidor Especial
CONDOMINIO DO SHOPPING CENTER COSTA DOURADA S/,11.737.619/0001-08,Consumidor Especial
COSTAZUL  ALIMENTOS EIRELI,17.493.338/0001-25,Consumidor Especial
COTESI DO BRASIL - COMERCIO| INDUSTRIA DE FIOS E PARTICIPACOES LTD,05.769.698/0001-28,Consumidor Especial
COTIPLAS IND E COMERCIO DE ARTEFATOS PLASTICOS LTD,48.725.956/0001-87,Consumidor Especial
COTRAGON EXTRACAO COMERCIO DE AREIA LTD,75.193.698/0001-08,Consumidor Especial
COOPERATIVA AGRICOLA MISTA GENERAL OSORIO LTD,90.657.289/0001-09,Consumidor Especial
COOPERATIVA TRITICOLA MISTA CAMPO NOVO LTD,88.094.701/0001-88,Consumidor Especial
COOPERATIVA TRITICOLA DE ESPUMOSO LTD,89.677.595/0001-28,Consumidor Especial
COTRIGUACU COOPERATIVA CENTRAL,77.118.131/0001-00,Consumidor Especial
COTRIJAL COOPERATIVA AGROPECUARIA E INDUSTRIA,91.495.549/0001-50,Consumidor Especial
COTRIJUC - COOPERATIVA AGROPECUARIA JULIO DE CASTILHO,91.023.168/0001-78,Consumidor Especial
COTRILAC - COMERCIO| TRANSPORTE E INDUSTRIA DE LACTEOS LTD,02.875.405/0001-07,Consumidor Especial
COTRIPAL AGROPECUARIA COOPERATIVA,91.982.496/0001-00,Consumidor Especial
COOPERATIVA TRITICOLA SARANDI LTD,97.320.451/0001-48,Consumidor Especial
COOPERATIVA TRITICOLA SEPEENSE LTD,97.225.346/0001-20,Consumidor Especial
COOPERATIVA TRITICOLA TAPERENSE LTD,97.663.728/0001-35,Consumidor Especial
COOPERATIVA TRITICOLA CACAPAVANA LTD,87.678.132/0001-55,Consumidor Especial
ALGODOEIRA COTTON NOVA PRATA LTD,37.354.699/0001-06,Consumidor Especial
HIGIE PLUS COTTONBABY INDUSTRIA E COMERCIO LTD,95.837.316/0001-49,Consumidor Especial
COUROQUIMICA COUROS E ACABAMENTOS LTDA EM RECUPERACAO JUDICIA,50.719.061/0001-81,Consumidor Especial
COUROS HIDRO INDUSTRIA E COMERCIO EIREL,10.859.915/0001-00,Consumidor Especial
COUROS NOBRE BENEFICIAMENTO LTD,91.198.630/0001-78,Consumidor Especial
COUTOFLEX INDUSTRIA DE MANGUEIRAS LTD,02.655.093/0001-18,Consumidor Especial
COVOLAN INDUSTRIA TEXTIL LTDA,56.724.412/0001-29,Consumidor Especial
COZIMAX MOVEIS MIRASSOL LTDA,02.043.201/0001-00,Consumidor Especial
CP KELCO BRASIL S/A.,54.105.671/0001-46,Consumidor Especial
CPA ARMAZENS GERAIS LTDA,03.836.990/0001-90,Consumidor Especial
CASA PUBLICADORA DAS ASSEMBLEIAS DE DEU,33.608.332/0001-02,Consumidor Especial
CPE PLASTICOS LTDA,10.756.910/0002-33,Consumidor Especial
CRUZEIRO PAPEIS INDUSTRIAIS LTD,48.410.211/0002-00,Consumidor Especial
CPM CONCESSIONARIA PAULISTA DE MEDICAMENTOS S/,18.676.762/0001-78,Consumidor Especial
C P N MINERACAO LTDA,05.396.051/0001-06,Consumidor Especial
CPQ BRASIL S/A,74.552.068/0001-10,Consumidor Especial
FUNDACAO CPQD - CENTRO DE PESQUISA E DESENVOLVIMENTO EM TELECOMUNICACOE,02.641.663/0001-10,Consumidor Especial
CONDOMINIO PARQUE SHOPPING PRUDENT,24.716.928/0001-35,Consumidor Especial
VITESCO TECNOLOGIA BRASIL AUTOMOTIVA LTDA,31.600.044/0001-86,Consumidor Especial
BATERIAS CRAL LTDA,71.683.379/0001-20,Consumidor Especial
CRAL ARTIGOS PARA LABORATORIO LTD,48.740.849/0001-28,Consumidor Especial
COOPERATIVA REGIONAL AGROPECUARIA VALE DO ITAJA,85.789.782/0001-42,Consumidor Especial
CREAM COLOR INDUSTRIA E COMERCIO DE SORVETES E EMBALAGENS PLASTICAS LTD,07.237.015/0001-17,Consumidor Especial
T4F ENTRETENIMENTO S.A.,02.860.694/0001-62,Consumidor Especial
SORVETERIA CREME MEL S.A,03.857.539/0001-50,Consumidor Especial
CREMOSO ALIMENTOS LTDA,03.549.286/0001-57,Consumidor Especial
CRESCO COMERCIO DE ALIMENTOS LTD,18.303.320/0004-29,Consumidor Especial
METALURGICA CRIPPA LTDA,88.618.632/0001-64,Consumidor Especial
CRISTAL GLASS INDUSTRIA DE VIDROS LTD,17.531.314/0001-13,Consumidor Especial
PACK INDUSTRIA E COMERCIO DE EMBALAGENS LTD,08.308.067/0002-80,Consumidor Especial
CRISTAL SETE VIDROS TEMPERADOS EIREL,03.196.363/0001-32,Consumidor Especial
"J. P. DA SILVA FILHO &amp, CIA LTD",18.139.601/0001-45,Consumidor Especial
CRISTALINA ALIMENTOS LTDA,10.666.522/0001-80,Consumidor Especial
CRISTAL MASTER INDUSTRIA E COMERCIO LTD,05.378.317/0001-80,Consumidor Especial
CRISTALPET SUL INDUSTRIA COMERCIO DE EMBALAGENS LTD,19.328.827/0001-57,Consumidor Especial
CRISTALPET DO BRASIL INDUSTRIA DE EMBALAGENS LTDA,09.428.630/0001-36,Consumidor Especial
CRISTALCOPO DESCARTAVEIS S/A,05.316.470/0001-82,Consumidor Especial
MURIAE COMERCIO E INDUSTRIA DE VIDROS LTD,10.657.085/0001-39,Consumidor Especial
CERAMICA CRISTOFOLETTI LTDA,48.173.223/0001-87,Consumidor Especial
CRODA DO BRASIL LTDA,44.144.293/0001-56,Consumidor Especial
CROMA REVESTIMENTOS TECNICOS LTD,07.347.306/0003-20,Consumidor Especial
CROMEX S/A,02.271.463/0001-13,Consumidor Especial
CROMEX S/A,02.271.463/0004-66,Consumidor Especial
CROMO AZUL INDUSTRIA E COMERCIO DE ART DE ARAME LTD,00.901.682/0001-03,Consumidor Especial
CROMOFIX CROMO DURO LTDA,88.112.313/0002-63,Consumidor Especial
CROMOVILLE INDUSTRIA E COMERCIO LTD,03.132.472/0001-96,Consumidor Especial
CROMUS EMBALAGENS INDUSTRIA E COMERCIO LTD,73.196.644/0001-70,Consumidor Especial
CRUSOE FOODS INDUSTRIA| IMPORTACAO E EXPORTACAO LTD,11.814.967/0001-23,Consumidor Especial
CRUZEIRO AGROAVICOLA LTDA,09.023.309/0001-71,Consumidor Especial
CRUZEIRO DO SUL INDUSTRIA TEXTIL S,43.248.129/0001-26,Consumidor Especial
FRIGORIFICO CRUZEIRO DO SUL EIREL,15.841.346/0001-90,Consumidor Especial
CRUZEIRO DO SUL EDUCACIONAL S.A,62.984.091/0001-02,Consumidor Especial
CRVR - RIOGRANDENSE VALORIZACAO DE RESIDUOS LTD,03.505.185/0001-84,Consumidor Especial
CRYOVAC LONDRINA LTDA,00.200.283/0001-15,Consumidor Especial
CONDOMINIO CIVIL DO CRYSTAL PLAZA SHOPPING CENTE,15.680.318/0001-38,Consumidor Especial
CS SILVA LTDA,02.108.321/0001-30,Consumidor Especial
CS3 MARMORES E GRANITOS LTDA,07.599.291/0001-25,Consumidor Especial
CURTUME SANTO ANTONIO LTDA,24.895.484/0001-42,Consumidor Especial
COSTAO DO SANTINHO TURISMO E LAZER LTD,04.908.757/0001-39,Consumidor Especial
CSB-CERAMICA SIMONASSI BAHIA LTD,32.644.916/0001-70,Consumidor Especial
COMPANHIA SULAMERICANA DE CERAMICA  EM RECUPERACAO JUDICIA,15.244.677/0001-42,Consumidor Especial
CENTRO DE INOVACOES CSEM BRASIL,08.663.733/0001-18,Consumidor Especial
FUNDACAO EDUCACIONAL SAO FRANCISCO XAVIE,11.508.880/0001-28,Consumidor Especial
CLOSURE SYSTEMS INTERNATIONAL (BRAZIL) SISTEMAS DE VEDACAO LTDA,09.074.885/0001-48,Consumidor Especial
CIA. SANEAMENTO DE JUNDIAI,01.201.289/0001-70,Consumidor Especial
CSM-COMPONENTES SISTEMAS E MAQUINAS PARA CONSTRUCAO LT,76.840.537/0001-21,Consumidor Especial
CSM INDUSTRIA E COMERCIO DE FOGOES LTD,05.091.666/0001-16,Consumidor Especial
CSO AMBIENTAL DE SALTO SPE S.A,21.147.808/0001-76,Consumidor Especial
CERAMICA SAO ROQUE LTDA,27.105.188/0001-99,Consumidor Especial
CSS SIDERURGICA SETELAGOANA LTD,07.613.875/0001-08,Consumidor Especial
CONDOMINIO DO SIDER SHOPPING CENTE,01.964.081/0001-02,Consumidor Especial
MISSAO SALESIANA DE MATO GROSSO,03.226.149/0022-06,Consumidor Especial
CASA DE SAUDE SANTA MARIA S,28.681.096/0001-10,Consumidor Especial
CTC - CENTRO DE TECNOLOGIA CANAVIEIRA S.A,06.981.381/0001-13,Consumidor Especial
CTB INDUSTRIA E COMERCIO DE PLASTICOS LTD,03.574.683/0001-89,Consumidor Especial
COMPANHIA TEXTIL DE CASTANHAL,05.389.812/0001-94,Consumidor Especial
CTG - COMPANHIA DE TRANSPORTE DE GAS S/,05.350.199/0001-00,Consumidor Especial
CENTRAL DE TRATAMENTO DE RESIDUOS NOVA IGUACU S.A,07.085.695/0001-09,Consumidor Especial
TUSSOR CONFECCOES LTDA,07.681.643/0001-97,Consumidor Especial
ASSOCIACAO CULTURA INGLESA - SAO PAUL,61.793.907/0001-40,Consumidor Especial
CUMMINS FILTROS LTDA,03.469.014/0001-47,Consumidor Especial
CURA - CENTRO DE ULTRASSONOGRAFIA E RADIOLOGIA S.A,50.252.998/0001-90,Consumidor Especial
CLUBE CURITIBANO,76.493.626/0001-49,Consumidor Especial
CURTIDORA RIBEIRAOZINHO LTDA,08.655.686/0001-60,Consumidor Especial
CURTIDORA TOCANTINS LTDA,09.233.233/0001-09,Consumidor Especial
LAMINACAO DE METAIS CURTOLO LTD,03.074.988/0001-21,Consumidor Especial
"M.J. NOVAES DE LIMA &amp, CIA LTD",04.333.952/0001-88,Consumidor Especial
CURTUME BAGE LTDA,05.893.701/0001-10,Consumidor Especial
CURTUME CENTRO OESTE LTDA,26.685.958/0001-57,Consumidor Especial
CURTUME CUBATAO LTDA,47.988.423/0001-25,Consumidor Especial
CURTUME DELLA TORRE LTDA,47.953.765/0001-00,Consumidor Especial
CURTUME KOEFENDER LTDA,91.155.440/0001-73,Consumidor Especial
CURTUME MODERNO S A,11.111.812/0001-20,Consumidor Especial
CURTUME NIMO LTDA,91.359.679/0001-65,Consumidor Especial
CURTUME NOROESTE EIRELI,32.756.560/0001-67,Consumidor Especial
CURTUME SULINO LTDA,88.221.494/0001-85,Consumidor Especial
CURTUME TOINZINHO LTDA,20.709.374/0001-98,Consumidor Especial
CVI REFRIGERANTES LTDA,72.114.994/0001-88,Consumidor Especial
CVL TEMPERA DE VIDROS LTDA,13.498.295/0001-10,Consumidor Especial
CVPLAST INDUSTRIA DE EMBALAGENS LTD,23.334.109/0001-60,Consumidor Especial
CW INDUSTRIA| COMERCIO E ARMAZEM GERAL LTD,00.477.367/0001-09,Consumidor Especial
CYBERGLASS INDUSTRIA E COMERCIO DE VIDROS LTDA,05.252.087/0001-08,Consumidor Especial
CYKLOP DO BRASIL EMBALAGENS LTDA,56.993.512/0001-50,Consumidor Especial
CYRELA GREENWOOD DE INVESTIMENTOS IMOBILIARIOS LTD,04.512.523/0001-78,Consumidor Especial
D'ARTHY EDITORA E GRAFICA LTD,01.692.620/0001-00,Consumidor Especial
D BURGER COMERCIO DE ALIMENTOS LTDA,28.835.723/0001-20,Consumidor Especial
D DORO MOVEIS LTDA,02.534.930/0001-50,Consumidor Especial
SOCIEDADE INDUSTRIAL DE PLASTICOS DAC LTD,43.140.862/0001-22,Consumidor Especial
DISTRIBUIDORA DE AGUA CAMACARI S/,01.944.031/0001-63,Consumidor Especial
DACAR QUIMICA DO BRASIL S/A,78.949.013/0001-07,Consumidor Especial
DACARTO INDUSTRIA E COMERCIO DE PLASTICOS LTD,62.143.847/0001-82,Consumidor Especial
COMERCIAL DACLANDE LTDA,03.222.166/0001-40,Consumidor Especial
DAF CAMINHOES BRASIL INDUSTRIA LTDA,13.114.506/0001-73,Consumidor Especial
GFG COMERCIO DIGITAL LTDA.,11.200.418/0001-69,Consumidor Especial
AGUA MINERAL SANTA CANDIDA LTD,72.824.857/0001-37,Consumidor Especial
"DAGNESE &amp, CIA LTDA",73.325.722/0001-90,Consumidor Especial
COMERCIAL DAHANA LIMITADA,00.070.509/0001-00,Consumidor Especial
DAICAST INDUSTRIA E COMERCIO LTD,60.480.746/0001-71,Consumidor Especial
MOVEIS DAICO INDUSTRIA E COMERCIO LTDA EM RECUPERACAO JUDICIA,81.373.748/0001-31,Consumidor Especial
DAIDO INDUSTRIA DE CORRENTES DA AMAZONIA LTDA,08.996.956/0001-05,Consumidor Especial
DAIICHI SANKYO BRASIL FARMACEUTICA LTDA,60.874.187/0001-84,Consumidor Especial
DAIRY PARTNERS AMERICAS BRASIL LTDA,05.300.331/0002-41,Consumidor Especial
DAKOTA NORDESTE S/A,00.465.813/0004-08,Consumidor Especial
DAL MOBILE LTDA,89.042.618/0001-28,Consumidor Especial
COMERCIAL DE SECOS E MOLHADOS DAL POZZO LTD,80.213.705/0001-26,Consumidor Especial
DALBA ENGENHARIA E EMPREENDIMENTOS LTD,03.222.465/0001-85,Consumidor Especial
SUPERMERCADOS DALBEN LTDA,46.241.741/0001-65,Consumidor Especial
DALGALLO COMPENSADOS E PORTAS LTD,97.458.749/0001-19,Consumidor Especial
DALFIOS FIACAO LTDA,07.807.149/0001-26,Consumidor Especial
COOPERATIVA DALIA ALIMENTOS LTD,89.305.239/0001-83,Consumidor Especial
DALILA TEXTIL LTDA,82.740.903/0001-73,Consumidor Especial
MOVEIS DALLA COSTA LTDA,03.029.980/0001-43,Consumidor Especial
ALIMENTOS DALLAS INDUSTRIA E COMERCIO LTD,03.938.789/0006-29,Consumidor Especial
DALLEACO SOLUCOES EM ACOS PLANOS LTD,07.480.681/0001-81,Consumidor Especial
DALLEMOLE ESTRUTURAS METALICAS LTD,92.278.209/0001-30,Consumidor Especial
METALURGICA DALLMAC LTDA,02.625.930/0001-66,Consumidor Especial
DALLON METAIS E DERIVADOS EIREL,02.631.144/0001-71,Consumidor Especial
DALLON PLASTICOS LTDA,08.393.617/0001-26,Consumidor Especial
DALPIAZ ACABAMENTO EM COUROS LTD,06.110.630/0001-03,Consumidor Especial
TEXTIL DALUTEX LTDA,43.390.996/0001-00,Consumidor Especial
DALVI ROCHAS ORNAMENTAIS LTDA,24.866.669/0001-29,Consumidor Especial
DAMAPEL INDUSTRIA COMERCIO E DISTRIBUICAO DE PAPEIS LTD,02.969.683/0001-15,Consumidor Especial
DISTRIBUIDORA AMARAL LTDA,21.759.758/0001-88,Consumidor Especial
DAMASIO EDUCACIONAL LTDA.,07.912.676/0001-09,Consumidor Especial
DAMENNY IND E COM DE PRODUTOS TEXTEIS LTD,79.302.519/0001-84,Consumidor Especial
DAN VIGOR INDUSTRIA E COMERCIO DE LATICINIOS LTD,55.566.871/0001-69,Consumidor Especial
DANCOR S A INDUSTRIA MECANICA,33.561.853/0001-51,Consumidor Especial
DANES INDUSTRIA E COMERCIO DE ALIMENTOS LTD,19.455.897/0001-76,Consumidor Especial
DANFOSS POWER SOLUTIONS INDUSTRIA E COMERCIO ELETROHIDRAULICA LTDA,04.529.320/0001-94,Consumidor Especial
DANISCO BRASIL LTDA,46.278.016/0001-61,Consumidor Especial
DANNAPLAS - INDUSTRIA E COMERCIO DE PLASTICOS EIREL,05.790.426/0001-00,Consumidor Especial
DANONE LTDA,23.643.315/0001-52,Consumidor Especial
DANTAS MINERIOS LTDA,17.833.812/0001-10,Consumidor Especial
COPOMAIS INDUSTRIA E COMERCIO DE DESCARTAVEIS LTD,54.867.601/0001-25,Consumidor Especial
LIGA DAS SENHORAS CATOLICAS DE CURITIB,76.689.835/0001-62,Consumidor Especial
DARNEL EMBALAGENS LTDA.,02.538.436/0001-64,Consumidor Especial
DARTHEL INDUSTRIA DE PLASTICOS LTD,89.274.120/0001-90,Consumidor Especial
CONTROLES GRAFICOS DARU S,61.793.691/0001-12,Consumidor Especial
DIAGNOSTICOS DA AMERICA S.A,61.486.650/0001-83,Consumidor Especial
SALOMAO E ZOPPI SERVICOS MEDICOS E PARTICIPACOES S/,45.796.554/0001-85,Consumidor Especial
DASS NORDESTE CALCADOS E ARTIGOS ESPORTIVOS S.,01.287.588/0001-79,Consumidor Especial
DASS SUL CALCADOS E ARTIGOS ESPORTIVOS LTD,81.786.121/0001-02,Consumidor Especial
DATA ENGENHARIA LTDA,26.389.015/0001-87,Consumidor Especial
DATAMETRICA TELEATENDIMENTO S/,01.077.145/0001-53,Consumidor Especial
DAUPER INDUSTRIA E COMERCIO DE BISCOITOS S/,92.260.371/0001-20,Consumidor Especial
DAUS INDUSTRIA DE ALIMENTOS S.A,04.865.228/0001-03,Consumidor Especial
DAVO SUPERMERCADOS LTDA,52.130.481/0001-53,Consumidor Especial
SUPERMERCADOS DB LTDA,22.991.939/0001-06,Consumidor Especial
DAGOBERTO BARCELLOS S/A,87.678.934/0001-65,Consumidor Especial
DBL INDUSTRIA E COMERCIO DE BEBIDAS E EMBALAGENS LTD,04.680.660/0001-11,Consumidor Especial
D. BORCATH ADMINISTRADORA DE BENS PROPRIOS LTD,80.381.460/0001-46,Consumidor Especial
DC MATRIX INTERNET S/A,10.666.296/0001-38,Consumidor Especial
DE AMORIM CONSTRUTORA DE OBRAS LTD,77.577.419/0001-35,Consumidor Especial
DE HEUS INDUSTRIA E COMERCIO DE NUTRICAO ANIMAL LTD,02.513.991/0001-31,Consumidor Especial
DE MARCHI INDUSTRIA E COMERCIO DE FRUTAS LTD,52.884.061/0001-62,Consumidor Especial
METALURGICA DE TONI LTDA,89.041.560/0001-06,Consumidor Especial
LATICINIO DEALE LTDA,04.800.830/0001-54,Consumidor Especial
DURATEX S.A.,97.837.181/0029-48,Consumidor Especial
DURATEX S.A.,97.837.181/0018-95,Consumidor Especial
DECHRA BRASIL PRODUTOS VETERINARIOS LTDA,79.578.266/0001-76,Consumidor Especial
DECKEL INDUSTRIA E COMERCIO DE PLASTICOS TECNICOS LTD,03.735.194/0001-61,Consumidor Especial
DECKER TINGIMENTOS LTDA,81.850.141/0001-03,Consumidor Especial
DECO COMERCIO DE MATERIAIS PLASTICOS LTD,00.425.544/0001-03,Consumidor Especial
DECOLORES MARMORES E GRANITOS DO BRASIL LTD,04.023.387/0002-33,Consumidor Especial
DECORALITA INDUSTRIA E COMERCIO DE PRODUTOS DE CONSTRUCAO LTD,17.222.720/0001-02,Consumidor Especial
DEERE-HITACHI MAQUINAS DE CONSTRUCAO DO BRASIL S.A,03.982.513/0001-33,Consumidor Especial
DEFENDI DO BRASIL INDUSTRIA E COMERCIO DE PECAS PARA ELETRODOMESTICOS LTDA,08.175.409/0001-50,Consumidor Especial
BANDEIRANTES DEICMAR LOGISTICA INTEGRADA S.,58.188.756/0001-96,Consumidor Especial
CENTRO EMPRESARIAL DEL PASEO,04.014.647/0001-23,Consumidor Especial
CONSTRUTORA DEL RIJO S.A.,04.853.691/0001-27,Consumidor Especial
DELCARO HOTEIS LTDA,05.982.547/0001-53,Consumidor Especial
DELFA INDUSTRIA E COM.DE ACESSORIOS DO VESTUARIO LTD,06.037.585/0001-09,Consumidor Especial
DELFIM COMERCIO E INDUSTRIA LTD,57.010.480/0001-99,Consumidor Especial
CLINICA DELFIN GONZALEZ MIRANDA S.A,16.047.490/0001-11,Consumidor Especial
DELGA INDUSTRIA E COMERCIO S/,61.532.198/0001-49,Consumidor Especial
DELLA PASQUA ENGENHARIA E CONSTRUCOES LTD,00.093.197/0002-31,Consumidor Especial
"DEL MORO &amp, DEL MORO LTDA",00.877.761/0001-26,Consumidor Especial
DELO INDUSTRIA E COMERCIO LTD,01.856.241/0001-08,Consumidor Especial
DELP ENGENHARIA MECANICA S/A,17.161.936/0001-05,Consumidor Especial
DELPAK EMBALAGENS LTDA,74.232.224/0001-65,Consumidor Especial
APTIV MANUFATURA E SERVICOS DE DISTRIBUICAO LTDA,00.857.758/0001-40,Consumidor Especial
DELPHI POWERTRAIN SYSTEM INDUSTRIA E COMERCIO LTDA,25.043.386/0002-20,Consumidor Especial
DELPHI POWERTRAIN SYSTEM INDUSTRIA E COMERCIO LTDA,25.043.386/0001-40,Consumidor Especial
DELRIO REFRIGERANTES LTDA,07.815.053/0001-00,Consumidor Especial
DELTA BIOCOMBUSTIVEIS INDUSTRIA E COMERCIO LTD,11.513.699/0001-00,Consumidor Especial
DELTA CUIABA PRODUTORA DE BIOCOMBUSTIVEIS LTDA,11.652.509/0001-35,Consumidor Especial
DELTA FILMES LTDA,01.735.159/0001-17,Consumidor Especial
DELTA PUBLICIDADE S A,04.929.683/0001-17,Consumidor Especial
DELUMA INDUSTRIA E COMERCIO LTD,52.827.888/0001-34,Consumidor Especial
JACOBS DOUWE EGBERTS BR COMERCIALIZACAO DE CAFES LTDA,02.333.707/0001-45,Consumidor Especial
JACOBS DOUWE EGBERTS BR COMERCIALIZACAO DE CAFES LTDA,02.333.707/0036-75,Consumidor Especial
DEMELLO ALIMENTOS LTDA.,02.765.094/0001-15,Consumidor Especial
DEMOBILE - INDUSTRIA DE MOVEIS LTDA,75.069.849/0001-10,Consumidor Especial
ACO PECAS DEMORE LTDA,89.089.668/0001-60,Consumidor Especial
DENDE DO TAUA S/A DENTAUA,04.719.951/0001-76,Consumidor Especial
METALURGICA DENK LTDA,82.770.017/0001-92,Consumidor Especial
DENDE DO PARA S/A - DENPASA,04.834.784/0001-04,Consumidor Especial
DENSO SISTEMAS TERMICOS DO BRASIL LTDA,03.523.188/0001-40,Consumidor Especial
DENTAL MORELLI LTDA,65.441.255/0001-35,Consumidor Especial
VIPI INDUSTRIA| COMERCIO| EXPORTACAO E IMPORTACAO DE PRODUTOS ODONTOLOGICOS LTDA,49.425.259/0001-73,Consumidor Especial
DENVER ESPECIALIDADES QUIMICAS LTDA,09.471.917/0001-49,Consumidor Especial
DENVER IMPERMEABILIZANTES| INDUSTRIA E COMERCIO LTDA,04.064.707/0003-84,Consumidor Especial
FABRICA MINEIRA DE ELETRODOS E SOLDAS DENVER S,22.671.564/0001-99,Consumidor Especial
DENVER INDUSTRIA E COMERCIO DE PRODUTOS QUIMICOS LTD,53.137.527/0001-29,Consumidor Especial
DEPINUS INDUSTRRIA E COMERCIO DE MADEIRAS DE PINUS LTD,79.107.959/0001-80,Consumidor Especial
AGROINDUSTRIAL E COMERCIAL DERIMAM LTD,08.326.364/0001-78,Consumidor Especial
MINERACAO DESCALVADO LIMITADA,54.114.475/0001-38,Consumidor Especial
DESCARPACK DESCARTAVEIS DO BRASIL LTD,01.057.428/0001-33,Consumidor Especial
DESK MOVEIS ESCOLARES E PRODUTOS PLASTICOS LTD,74.148.958/0001-60,Consumidor Especial
DESLEECLAMA BRAZIL INDUSTRIA E COMERCIO DE ARTIGOS TEXTEIS LTD,04.816.261/0001-35,Consumidor Especial
IRMAOS TONIELLO LTDA,71.321.566/0001-63,Consumidor Especial
DESTRO BRASIL DISTRIBUICAO LTD,13.495.487/0001-72,Consumidor Especial
DESTRO BRASIL DISTRIBUICAO LTD,13.495.487/0002-53,Consumidor Especial
DEVILLE HOTEIS E TURISMO LTDA,81.071.623/0001-57,Consumidor Especial
DEZ ALIMENTOS LTDA,04.945.225/0001-71,Consumidor Especial
DF PLAZA LTDA,17.312.925/0001-70,Consumidor Especial
MAREL INDUSTRIA E COMERCIO DO BRASIL LTD,67.552.869/0001-10,Consumidor Especial
DI SOLLE CUTELARIA LTDA,01.256.141/0001-32,Consumidor Especial
DIA BRASIL SOCIEDADE LIMITADA,03.476.811/0001-51,Consumidor Especial
DIAGNOSE CENTRO DE DIAGNOSTICO POR IMAGEM LTD,35.741.024/0002-67,Consumidor Especial
DIAMANTE TEMPERA DE VIDROS LTDA,56.695.711/0001-82,Consumidor Especial
DIAMANTE ALIMENTOS LTDA.,23.828.180/0001-08,Consumidor Especial
DIATOM MINERACAO LTDA,43.338.797/0001-44,Consumidor Especial
DISTRIBUIDORA DE CARNES SABARA LTD,11.408.281/0001-32,Consumidor Especial
DICKOW ALIMENTOS LTDA.,87.067.187/0001-29,Consumidor Especial
DIELAT INDUSTRIA E COMERCIO DE LATICINIOS LTDA,24.418.900/0001-11,Consumidor Especial
DIGIPIX GRAFICA DIGITAL S.A.,06.972.254/0001-58,Consumidor Especial
DIGITRO TECNOLOGIA S.A.,83.472.803/0001-76,Consumidor Especial
DIGITRON DA AMAZONIA INDUSTRIA E COMERCIO LTD,84.489.988/0005-18,Consumidor Especial
DIGUINHO INDUSTRIA E COMERCIO DE FRALDAS LTD,53.918.116/0001-70,Consumidor Especial
DIHELO ALIMENTOS LTDA,79.875.183/0001-49,Consumidor Especial
DIKLATEX INDUSTRIAL TEXTIL S/,72.020.118/0001-92,Consumidor Especial
DINAGRO AGROPECUARIA LTDA,55.991.921/0001-55,Consumidor Especial
DINAMICA ECOSOLUTION LTDA,86.685.245/0001-15,Consumidor Especial
DINAMO INTER-AGRICOLA LTDA,56.851.611/0001-06,Consumidor Especial
DINI TEXTIL INDUSTRIA E COMERCIO LTDA,65.538.209/0001-59,Consumidor Especial
DINJET DANTAS INDUSTRIA DE INJETADOS LTD,01.274.980/0001-83,Consumidor Especial
DINOPLAST INDUSTRIA E COMERCIO DE PLASTICOS LTD,53.775.003/0001-63,Consumidor Especial
DIONISIO RECICLAVEIS - INDUSTRIA E COMERCIO EIREL,05.855.407/0001-14,Consumidor Especial
DIPAES INDUSTRIA DE PAES LTDA,08.277.842/0001-05,Consumidor Especial
DISK - BRITA INDUSTRIA E COMERCIO DE PEDRAS LTD,29.209.171/0001-07,Consumidor Especial
DISPAFILM DO BRASIL LTDA,68.871.912/0001-72,Consumidor Especial
DISTRIBUIDORA DE ALIMENTOS ALBUQUERQUE LTD,03.539.462/0001-70,Consumidor Especial
DISTRIBUIDORA DE EMBALAGENS RIO MINAS EIREL,00.187.378/0001-46,Consumidor Especial
DISTON PARTICIPACOES E CONSTRUCOES LTD,19.009.381/0003-60,Consumidor Especial
CDA COMPANHIA DE DISTRIBUICAO ARAGUAIA - EM RECUPERACAO JUDICIA,26.651.646/0001-22,Consumidor Especial
DISTRIBOI - INDUSTRIA| COMERCIO E TRANSPORTE DE CARNE BOVINA LTDA,22.882.054/0001-60,Consumidor Especial
DISTRIVIDROS INDUSTRIA E COMERCIO DE VIDROS LTD,08.018.225/0001-87,Consumidor Especial
DITALIA MOVEIS INDUSTRIAL LTD,73.289.050/0001-04,Consumidor Especial
DITIN INDUSTRIA TEXTIL LTDA,71.805.063/0001-63,Consumidor Especial
